subject,group,story,event_num,valence,event_start_sec,event_end_sec,event_duration_sec,transcript,mean_pupil_size,z_pupil
1003,3,Impatient Billionaire,70,positive,1175,1210,35,"“I want you to be able to look up with binoculars and literally wave at yourself,"" said the impatient billionaire. “But you could also look at the White House or your grandmother in Florida or see two people on a date in Brazil. My God, do you realize what this is going to mean for humanity?” “You're only going to be able to see one hemisphere at a time,” said the head engineer. “That means you won't be able to see China and Brazil at the same time. Which one is more important to you?” “I don't know. Same. Brazil” said the impatient billionaire.",2279.4239064374783,0.002054565721751519
1003,3,Impatient Billionaire,71,positive,1210,1230,20,The engineer took some notes with a little pencil. “Wait” said the impatient billionaire. “Is this mirror going to burn up the whole planet? Don't just yes me on everything. Really think about it. A mirror that big reflecting the sun facing us? I do not want to burn up the planet. I do not want to be that guy.”,2199.164114670417,-0.41987836778392024
1003,3,Impatient Billionaire,72,positive,1230,1245,15,"“No, that should be okay,"" said the head engineer. “We should be able to come up with a material that reflects plenty of light, but not a meaningful amount of heat. Let me talk with the team.” The engineers talked numbers and said they could probably have something up in 18 months. ",2286.6585462690064,0.04008771706399522
1003,3,Impatient Billionaire,73,positive,1245,1270,25,"“Why not six?” Asked the impatient billionaire, trying to force into his eyes the rogue, intoxicating glimmer that he knew had served him well in life so far. “18,” said the engineering team. “Fine,” said the impatient billionaire. “If you can really guarantee 18 months, fine.” “We can,” said the engineering team. ",2221.3840085379993,-0.30306639013832964
1003,3,Impatient Billionaire,74,positive,1270,1282,12,"35 months and two weeks later, more than a year late and $700 million over budget, the Mirror for Earth finally went up into the sky.",2072.109651672576,-1.0878150906108999
1003,3,Impatient Billionaire,75,positive,1282,1302,20,"But nobody remembers how long anything takes. They only remember how good it was in the end. And in the end, the mirror was magnificent. After a very short amount of time, the mirror for Earth became one of those things that people couldn't ever imagine not existing.",2315.3871865752344,0.1911167592924696
1003,3,Impatient Billionaire,76,positive,1302,1327,25,"When people caught sight of themselves in the mirror, individually and as a species, they thought twice about how they looked doing whatever they were doing. Crime disappeared, wars evaporated, meanness declined dramatically. The mirror changed everything, forever, for the better. Besides all that, the thing was, quite simply, beautiful.",2284.2191689396554,0.027263691361468174
1003,3,Impatient Billionaire,77,positive,1327,1346,19,"One summer night, a few years later, the impatient billionaire couldn't sleep. The air conditioning in his master bedroom was broken, and even an impatient billionaire didn't have a way to get an air conditioner fixed in the middle of the night without waking up a wife who was asleep in the same room.",2230.0195722903095,-0.2576684559266086
1003,3,Impatient Billionaire,78,positive,1346,1362,16,"The impatient billionaire's mind started running through all of the projects he had in the works, none of which was going as fast as it should be. “You'd think the man who put up the mirror for Earth would attract the best and brightest and most resourceful people, but apparently not,” he thought to himself. ",2447.6083390835456,0.8862152328998746
1003,3,Impatient Billionaire,79,positive,1362,1375,13,"Impatient for nothing in particular, the impatient billionaire wandered outside to his bedroom balcony and picked up a pair of binoculars that had been a gift from the head engineer, but that he had never actually used.",2506.647957791222,1.1965918108342513
1003,3,Impatient Billionaire,80,positive,1375,1393,18,"After a couple of minutes spent searching and focusing, he found what he thought to be himself up in the sky and made some specific gestures with his arms to confirm that he really was staring at himself and not at one of his neighbors who might just happen to have a similar pair of pajamas and late night impulse. ",2085.7222764812777,-1.0162522994325063
1003,3,Impatient Billionaire,81,positive,1393,1405,12,"Yes, that was him. That was him, waving widely. That was him, the little figure in red jutting out into the endless black.",2285.494886798451,0.03397025471823987
1003,3,Impatient Billionaire,82,positive,1405,1425,20,"And then, after the impatient billionaire had established that it was definitely certainly him up there in the sky, he made a few more funny gestures anyway, just for fun. What a cool thing he had made.",2046.9996766943145,-1.2198204842154716
