subject,group,story,event_num,valence,event_start_sec,event_end_sec,event_duration_sec,transcript,mean_pupil_size,z_pupil
1003,3,Sea Ice,1,neutral,0,13,13,"I'm an arctic guy. I study arctic science. When I go to a cocktail party and I tell people what I do, they kind of run away from me usually. The northern hemisphere of your planet Earth, where you live, it's covered with an ocean, but on top of that ocean is a sea ice cover. ",2689.5572893876847,2.1581625942477465
1003,3,Sea Ice,2,neutral,13,32,19,"So when I started my research work in the arctic, and there wasn't much happening, really. It wasn't no big changes going on in the sea ice cover. We never really thought that sea ice would become sort of a fundamental characteristic of our international discourse about global warming and the fact that our planet is warming at a global scale.",2244.1343018330676,-0.18346605506691396
1003,3,Sea Ice,3,neutral,32,52,20,And we're going to have at some point in the near future no ice in the northern hemisphere in summer. Now that's a very major change that's happened on our planet system. And I work with a whole bunch of scientists from all around the world that study this. And we study the sea ice itself. We also study the connections with glacial ice and the land and all those kind of things.,2064.589726005592,-1.127348015211849
1003,3,Sea Ice,4,neutral,52,80,28,"But when you look at what's happening to the sea ice cover, this change that we have, this reduction, we found recently that this is significant over at least the last 1,450 years. So that includes the last medieval warm period it includes the cold periods before that it includes right up to before the industrial revolution so in fact what we're seeing in the Arctic right now is unique to our time scale of what we're talking about on the planet.",2324.496461618157,0.23900503630327122
1003,3,Sea Ice,5,neutral,80,94,14,To do this work we have a whole bunch of tools. One of our largest and most visible tools is the research icebreaker the Amundsen. The Amundsen is a ship that will hold 40 scientists and we can deploy to the Arctic anywhere in the Arctic for any amount of time.,2353.842723919656,0.3932809728299339
1003,3,Sea Ice,6,neutral,94,107,13,"So we've overwintered now twice in the high Arctic and we're studying everything in this system. So we study everything from the bottom of the ocean to the top of the atmosphere in the physical world, everything from viruses to whales in the biological world and all the connections between those.",1928.9981497521137,-1.8401651091476365
1003,3,Sea Ice,7,neutral,107,122,15,"This takes a lot of people so the networks are not just here at the University of Manitoba but We have a national network called ArcticNet, which includes Laval University and many other universities across the country. We also have an international network, which includes universities around the world that study the Arctic.",2569.573633078748,1.5273977372182714
1003,3,Sea Ice,8,neutral,122,132,10,Now I could talk for a long time about this. I write books about these kind of things. But I wanted to just highlight a few key things that are happening. And these are things that we were surprised about.,2477.726127126941,1.0445471495429353
1003,3,Sea Ice,9,neutral,132,149,17,"First one is, multi-year sea ice is being replaced with very thin first-year sea ice. So multi-year sea ice is really, really thick, really, really hard. And this young stuff is very saline. It's very salty. Remember, it's an ocean that this ice forms on. Even if you were to taste it, you'd spit it out right away because it's really, really salty.",2076.2726394810597,-1.0659298898209482
1003,3,Sea Ice,10,neutral,149,175,26,"The other thing is we're finding crystals in the ice itself called ikaite, which is associated with how CO2 moves through the systems. Up until just recently, we thought the ocean was capped by this ice cover and that CO2 couldn't move between the ocean and the atmosphere. CO2 is the big problem, right? This is what's causing our planet to warm, and we thought that it was decoupled in the Arctic, but we're finding, in fact, it's not. This young sea ice actually plays an active role in exchanging carbon dioxide with the surface.",2410.110577128925,0.6890861306050484
1003,3,Sea Ice,11,neutral,175,186,11,"There are similar processes going on with bromine, mercury, and they're very reactive with the atmosphere, so we're very concerned about what these young ice types mean for the evolution of the Arctic atmosphere.",2313.410001402282,0.18072251926591984
1003,3,Sea Ice,12,neutral,186,210,24,"Snow on sea ice is also very important. Snow falls on the sea ice. When it falls on ice, it's already there. It forms a thick blanket. It insulates that ice, so the ice can't grow as thick as it would have otherwise. If it falls in the open ocean, it does absolutely nothing at all. So what that's doing is it's protecting this multi-year sea ice from growing too thick, which means that it gets thinner and thinner each year because the snow cover doesn't allow it to grow as thick as it used to be.",2128.1384272348223,-0.79326678549791
1003,3,Sea Ice,13,neutral,210,232,22,"Of course, this is affecting the animals that live in this environment, in particular polar bears. You've probably heard in the media that polar bears, the sea ice is disappearing. This is an important habitat for the polar bear. So what's going to happen with our polar bears? We have lots of them here in Manitoba. We have lots of them in Canada. Unfortunately, it's not as simple and straightforward as reduction in sea ice means reduction in polar bear habitat. It's much more complicated than that.",2275.0619357814508,-0.020876705768522744
1003,3,Sea Ice,14,neutral,232,246,14,"The big problem is when you remove all the sea ice and you have open water. In those areas, the length of that open water is really important because the polar bears have to go on land and have to be able to forage on the sea ice. They have to wait for it to happen in the fall.",2065.081500068617,-1.1247627147959656
1003,3,Sea Ice,15,neutral,246,263,17,"When you look at the rest of the ecosystem in the Arctic, a good way to think about it is that the sea ice acts like the trees in a tropical rainforest. If you're sitting in your seat right now and you think, okay, if we clear cut all the tropical rainforest trees, we can expect there to be an impact on everything in the tropical ecosystem, right? ",2377.48272905467,0.5175586029495678
1003,3,Sea Ice,16,neutral,263,275,12,"Well, sea ice plays exactly the same role. If you get rid of all the sea ice, it changes the light environment and the heat environment, which affects everything that lives in the ocean because the ocean has evolved to take advantage of the timing and presence of the sea ice.",2407.998476096704,0.67798262578944
1003,3,Sea Ice,17,neutral,275,287,12,"So in fact, our research work shows that the change in sea ice is affecting everything in the marine system, right? From the very smallest viruses and bacteria all the way up through the food chain to polar bears, ring seals, those kinds of things. ",2257.5381196014637,-0.11300098125250857
1003,3,Sea Ice,18,neutral,287,300,13,"Another thing we're finding about the ecosystem is that invasive species are becoming a key thing in the Arctic. So on the Atlantic side of the Arctic, we're getting species moving north and displacing the Arctic species. The same's happening on the Pacific side.",2543.1931001766593,1.3887129064984725
1003,3,Sea Ice,19,neutral,300,319,19,"The other thing that was surprising to us is just how thick some of the multi-year ice is. It piles up on itself. When it piles up on itself, it can actually get thicker in very localized areas in the Arctic. And so this was a big surprise to us as well. This idea of the ice being able to move faster is also a big hazard.",2520.786949742829,1.2709217613562893
1003,3,Sea Ice,20,neutral,319,338,19,"What is the big paradox for us from an ice hazards perspective is one of the things that people are looking at the Arctic for is to increase development. CO2 is the thing that is causing a lot of this issue of our warming planet, yet it is opening up the Arctic for new development. And so people around the planet are interested in developing these resources that are there.",2125.198346956475,-0.8087230515717829
1003,3,Sea Ice,21,neutral,338,353,15,And of course the big resources are oil and natural gas. There's also lots of minerals and transportation is a big thing but we have to remember that there are hazards that are still there and we need to pay attention to those when we think about how to develop these resources sustainably.,2166.853423481672,-0.5897385732082
1003,3,Sea Ice,22,neutral,353,366,13,"It's very important that you remember that you live on planet Earth, and it is a unit. It functions as a unit. It doesn't operate as Manitoba, Saskatchewan, Ontario, British Columbia, northern states, right? It operates as a whole unit. ",2322.1607946772006,0.22672622542683463
1003,3,Sea Ice,23,neutral,366,381,15,"And unfortunately, it doesn't come with a manual. So we have to figure it out. And that's what research groups like mine do, is we try to figure out what these characteristics are so that we can inform you and we can spread these ideas on really cool things like TED.",2252.3211762665687,-0.1404269209012638
1003,3,Dont Look,24,negative,383,410,27,[music],2551.7786740288725,1.4338480393157569
1003,3,Dont Look,25,negative,410,431,21,"“How are you feeling today, Stephen?” Dr. Acosta said. “I'm fine.” Stephen said as he adjusted himself on the overplushed chair. “Good. How is the progress going?” “Um, I haven't exactly started.” “Stephen, you know things won't get better unless you try.” Dr. Acosta said as she tapped away on her iPad. ",2361.94619146853,0.43588162951227094
1003,3,Dont Look,26,negative,431,448,17,"“Yes, yes, I know. I just don't feel comfortable. This week has been extra challenging.” “There are always going to be challenges. They should not give you the reason to avoid trying something new.” “Yes, you're right.” Stephen said as he clutched his white cane tightly. ",2231.236439479292,-0.2512712758264609
1003,3,Dont Look,27,negative,448,467,19,"“Please tell me what has been challenging about this week.” Dr. Acosta said as she finally looked up at Stephen. “Well, on Tuesday, I misplaced my cell phone and it was ringing. Susan was outside in the garden and couldn't hear the phone. It drove me nuts.” Stephen said as he ran his fingers through his dirty blonde hair.",2222.4338419421774,-0.2975473216463166
1003,3,Dont Look,28,negative,467,492,25,"“Susan is your new nurse, correct?” Dr. Acosta said. “Yes, she's quite nice. A little more attentive than Monica was. It doesn't normally bother me.” “Should it have bothered you?” “No.” Steven said. “Did you try locating the phone yourself?” “No.” “It stopped ringing after the fifth ring.” “I see.” Dr. Acosta said, and she went back to writing on her device. Steven didn't like the tone of her voice. ",2388.5431861471384,0.5757044192318128
1003,3,Dont Look,29,negative,492,508,16,"“I did do the squinting exercises.” Steven said, trying to find something that she would approve of. “Good. What did you think?” “It was strange at first because it felt like my eyes would open whenever I released from squinting. I didn't like the sensation.” ",2515.557391799254,1.2434295055767768
1003,3,Dont Look,30,negative,508,524,16,"“This is good progress, Steven. Eventually, the strangeness will go away and the need to open your eyes will happen, especially if you start with the other lesson.” Dr. Acosta said, Steven could hear that she was smiling. Steven tightened his lips.",2488.4341703385267,1.1008402944028517
1003,3,Dont Look,31,negative,524,544,20,"“I'm not sure I'm ready to open my eyes.” “It's normal to feel apprehensive about it. These sessions and lessons are here to help you get to a point where you want to open your eyes and live a normal life. Is that not what you want?” “Yes, Dr. Acosta. It is.” Stephen said as he steadied his voice.",2217.7279160887056,-0.32228679650040465
1003,3,Dont Look,32,negative,544,564,20,"Stephen was guided out of the office and into Susan's car. He could smell her perfume as she clipped his seatbelt into place. He lowered his head as the car started. It was always a jarring feeling when he rode in one. “Do you need to stop anywhere else?” Susan said. “No, I’d like to go home and rest.”",2218.8808552634755,-0.3162256917123914
1003,3,Dont Look,33,negative,564,586,22,"He thought about what Dr. Acosta had said, and when she had asked him at the end of the session, Stephen couldn't remember the last time he had lied. Then it came to him, and he shuddered at the memory. The last time he had his eyes open was the last time he had lied, and it was to tell the police a different story of what had happened that night.",2385.0330721165833,0.5572514345274675
1003,3,Dont Look,34,negative,586,600,14,Stephen was 11 years old again and found himself sitting on a metal chair next to a desk. He could see the room through the slits of his eyelids. The lids kept closing on him. It felt like his face was covered in blood. ,2221.3868784875312,-0.30305130255588814
1003,3,Dont Look,35,negative,600,617,17,"He felt a hand on his shoulder. “Hey, how you doing, kid? Still don't want to open your eyes?” It was Officer Brennan returning. Stephen could sense someone else was there. “Stephen, this is Dr. Coolidge. She wanted to ask you some questions.” Officer Brennan said. ",2206.9710193133296,-0.37883676893273716
1003,3,Dont Look,36,negative,617,637,20,"“Hello, Stephen.” Dr. Coolidge said, as the officer grabbed an extra chair for her to sit on. “Are you in pain? Does your eyes bother you?” Dr. Coolidge said. “No, I just can't open them.” Stephen said, squirming in his seat. He decided to keep his eyes closed. He didn't want to see the doctor and officer.",2312.623749332994,0.1765891215238427
1003,3,Dont Look,37,negative,637,649,12,"“Okay, if it makes you feel better to have your eyes closed, then do so.” Stephen nodded. “We would like to know what had happened. Take your time, and if it gets too scary, you can stop.” ",2095.2736583106903,-0.9660398273392167
1003,3,Dont Look,38,negative,649,664,15,"“I was out with my friends in the woods. We have a boy's only house. Well, it's a big tent that we got from Michael's dad. We were hanging out even though it was getting late.” Stephen paused and licked his lips. ",2311.869270518327,0.1726227586348853
1003,3,Dont Look,39,negative,664,686,22,"“Who was there with you?” Dr. Coolidge said. “It was me, Tommy, Richard, Ismael, and Michael.” “What were you all doing in the tent?” “At first, we were reading comic books and eating gummy bears.” Stephen said, as his heartbeat accelerated, he was getting to the part that he did not want to talk about. “Yes?” Dr. Coolidge pressed gently.",1996.663274393669,-1.4844434718563302
1003,3,Dont Look,40,negative,686,706,20,"“Richard took out his mom's gun from his backpack. He said that she kept the gun because she was afraid that her boyfriend would come back. He was showing it off. I didn't care about it. I just wanted to go back to reading Spider-Man comics, but...” Steven broke off. He closed his eyes tighter. “It's alright, Steven. If you don't want to say it,” Dr. Coolidge said.",2260.2529427259788,-0.09872891226683021
1003,3,Dont Look,41,negative,706,723,17,"“I'll say it. Stephen shot me in the head.” Stephen recognized Richard's voice and shrunk back, falling off the chair. He could feel Richard's breath on his cheek. How could he still be alive? Stephen thought. “You shot me, liar!” Richard's voice echoed.",2357.6194766194326,0.41313570096537716
1003,3,Dont Look,42,negative,723,736,13,Stephen woke up panting. He felt cold sweat covering his body. His pajamas sticking to him as he tried to pull them off in bed. He staggered to his feet and slipped off his bottoms. Stephen grabbed his cell phone. ,2344.027074039495,0.3416792198597677
1003,3,Dont Look,43,negative,736,752,16,"“Hey Siri, what time is it?” Stephen said. His cell phone answered back that it was about three in the morning. He decided to take a shower instead of going back to bed. The hot water wasn't enough to wash away the bad dream he had.",2135.1185684155776,-0.756571556419475
1003,3,Dont Look,44,negative,752,771,19,"It kept playing out over and over in his mind. As the water streamed down his face, he realized that it reminded him of the blood that splattered on his face when the gun went off. Stephen staggered back onto a tiled wall and slid down. He wrapped his arms around him as he sobbed uncontrollably.",2479.9979926707692,1.0564905507446238
1003,3,Dont Look,45,negative,771,786,15,"Later that morning, Susan had arrived at around seven and had let herself in. She prepared him a breakfast of the usual, two scrambled eggs, two Canadian bacon strips, and sliced grapefruit. “Here you go, son.” Susan said. ",2350.4103765449236,0.3752368144195254
1003,3,Dont Look,46,negative,786,800,14,"“I need to take my mother to a doctor's appointment. She just turned 90 not too long ago, and I feel she should go more often than not. Will you be all right for a couple of hours?” “Yes, that's fine. I can listen to my audio book outside,” he said. ",2267.315120484133,-0.061602409533248845
1003,3,Dont Look,47,negative,800,817,17,"“Oh, that's a wonderful idea. Spring is finally starting up and you can feel the change. Well, I better get going. Unless there's anything else you need.” Susan said, “No, it's fine. Go ahead. Thank you for breakfast.” Stephen said, and he felt a squeezing hand on his shoulder.",2102.9334013724706,-0.9257718701367279
1003,3,Dont Look,48,negative,817,837,20,"After eating, Stephen placed the dirty dishes in the sink. He headed back upstairs to get his earphones, which he kept in his office. His white cane smacked into the desk chair, and he rested his hands on the desk. He searched around and came across what felt like a notepad. It occurred to him that he didn't own a notepad.",2508.7048006143996,1.2074048182821429
1003,3,Dont Look,49,negative,837,850,13,"Maybe it's Susan's, but that means she's been in my office, he thought. Stephen opened it and ran his fingers over the pages. He could feel the slight indentation where writing implement was used.",1975.8064479203574,-1.5940896817922343
1003,3,Dont Look,50,negative,850,874,24,"Closing it, he ran his fingers over the cover. There were letters, and it spelled out journal. This is definitely not mine, Stephen thought. Opening it again, he flipped a page that had pages attached to it. Newspaper clippings, he wondered. Stephen realized that if this was Susan's journal, he was being intrusive. Yet she did leave it here.",2218.7641037472317,-0.3168394649188176
1003,3,Dont Look,51,negative,874,893,19,"He hadn't had this much curiosity since that night when Richard was showing off his gun. Stephen shuddered and gasped. He took out his phone from his back pocket. “Hey Siri, what day is it today?” Stephen said. Siri answered back, April 22. He almost dropped his phone.",2100.1493186347566,-0.9404080431292459
1003,3,Dont Look,52,negative,893,902,9,It was 23 years ago today that Richard was shot. Somehow he had forgotten. His desire to go outside to sit and listen to his audiobook was dashed.,2111.9419071350235,-0.8784133462829866
1003,3,Dont Look,53,negative,902,922,20,"Stephen knew that he should call Tommy, Ismael, and Michael. Yet he didn't want to relive the memory, not this year. Besides the sobering recount of what had happened, he would have to endure the questioning about his eyes, and the tense silence filled with hate. They never voiced it, but he knew that they hated him because of what happened. ",2187.839007284926,-0.4794154744250062
1003,3,Dont Look,54,negative,922,943,21,"Last year, Michael didn't show up at the bar to meet with them. Tommy had said that he had an emergency. Steven didn't believe it for a second. They're probably deciding to meet without me, he thought. Steven placed his phone on the desk and sat down without dialing any of them. He gripped his white cane between his legs and tightened his eyes. ",2186.657890621167,-0.4856247108032743
1003,3,Dont Look,55,negative,943,957,14,"“I don't care about Dr. Acosta's lessons. I'm never opening my eyes again. It's better this way,” Steven told himself. “It's not my fault.” Stephen said out loud, but he knew it wasn't entirely true. ",2139.910694952767,-0.7313789168293429
1003,3,Dont Look,56,negative,957,974,17,"He was jealous when Richard pulled out the gun to show it off. Richard was always the cool one in the group. His mother gave him everything, even though they were known in the neighborhood as being poor. Stephen's father once told him that Richard's mother was a drug dealer, and that he should stay away from him.",3073.8803575239394,4.178583479754952
1003,3,Dont Look,57,negative,974,984,10,"Yet he kept hanging out with Richard, even though he hated him. Stephen didn't want to be alone. The others would never think of hanging with him without Richard. ",1950.6109666201955,-1.7265445898104166
1003,3,Dont Look,58,negative,984,1003,19,"So when Richard took that gun out, Stephen had it in his mind to grab the weapon and pose with it like he was an action star, but not before scaring Richard. It didn't go as planned. He was not counting on there being bullets in the gun. Richard still had the gun in his hands. It was pointed towards his face when Stephen grabbed it.",2030.991423248608,-1.3039773102916292
1003,3,Dont Look,59,negative,1003,1009,6,The police believed it was a mistake made by Richard and that Stephen was trying to take the gun away.,2691.7747600048256,2.169820036434593
1003,3,Dont Look,60,negative,1009,1024,15,"The stairs creaked, startling Stephen from his memory. He swung around in his desk chair. “Hello?” Stephen said, could it be Susan? But she said that she would be out for a couple of hours. She would have called to say that she was coming back, he wondered.",2132.9956184340986,-0.7677320951356851
1003,3,Dont Look,61,negative,1024,1031,7,"Stephen waited for the sound to return, but no sound came. Stupid old house, he thought. ",2117.4074616183198,-0.8496804354991501
1003,3,Dont Look,62,negative,1031,1047,16,"The hairs stood up on his arms as he felt a presence. “Who’s there?” Stephen said. A breeze crossed his face as if someone had walked past him. He shrunk back in his chair. Taking his white cane, he swung it back and forth. It didn't hit anything.",2237.371764629499,-0.21901732049411832
1003,3,Dont Look,63,negative,1047,1061,14,"Suddenly, someone grabbed it and yanked it. Stephen hopped up to his feet and was dragged. He was being pulled out of the office. Just as he was about to pull it back, the person let go. Stephen caught a whiff of the perfume. ",2111.7678866378747,-0.8793281876653967
1003,3,Dont Look,64,negative,1061,1075,14,"“Susan?” Before Stephen could turn around and confront the voice, he was pushed from behind. His eyes were forced open as his body went airborne and slammed into the staircase. He saw everything.",2050.146223407285,-1.203278805551895
1003,3,Dont Look,65,negative,1075,1093,18,"Stephen's body lay in a crumbled heap at the bottom. Susan checked his pulse with a gloved hand. She smirked and took note of the white cane nearby. After grabbing her journal with the newspaper clippings and cleaning up, she left without so much as a backward glance.",2344.443612886207,0.34386900198656967
1003,3,Impatient Billionaire,66,positive,1095,1105,10,"The impatient billionaire and the mirror for Earth. If only the Earth could hold up a mirror to itself,",2502.3547225234415,1.1740218874531643
1003,3,Impatient Billionaire,67,positive,1105,1128,23,"“Say no more,” thought the impatient billionaire in the audience at the TED conference, who found this speaker's voice as whiny and irritating as his ideas were inspiring and consciousness shifting. He already knew the part of the speech that was going to stay with him. A mirror up to Earth. Amazing, unbelievable, tricky, but doable. He got it, let's make it.",2574.7018403284274,1.5543571832975998
1003,3,Impatient Billionaire,68,positive,1128,1156,28,"“I want you to build a mirror for Earth,” he said to his engineers, who were used to things like this. “How big do you want the mirror to be?” “Full length.” “How big do you want the earth to look?” “Full size.” “Can't be full size,” said the head engineer. “Yes, it can be,” said the impatient billionaire. “And by the end of today, my head engineer is going to be somebody who tells me how it's going to happen, not why it can't.”",2174.237655411061,-0.5509190027725338
1003,3,Impatient Billionaire,69,positive,1156,1175,19,"“If it's full size,” said the head engineer, “you'll only see the reflection of what is in your field of vision up to your horizon point. That's not what you want, is it? You're picturing seeing like China, right?” “Yes,” said the impatient billionaire. “Exactly. Things like China.” “So let's figure out how big,” said the engineer.",2278.854337493387,-0.000939709370708962
