subject,group,story,event_num,valence,event_start_sec,event_end_sec,event_duration_sec,transcript,mean_pupil_size,z_pupil
1038,2,Dont Look,1,negative,0,27,27,[music],990.0970157416767,1.087018716608197
1038,2,Dont Look,2,negative,27,48,21,"“How are you feeling today, Stephen?” Dr. Acosta said. “I'm fine.” Stephen said as he adjusted himself on the overplushed chair. “Good. How is the progress going?” “Um, I haven't exactly started.” “Stephen, you know things won't get better unless you try.” Dr. Acosta said as she tapped away on her iPad. ",960.0960083054947,0.9241084097556648
1038,2,Dont Look,3,negative,48,65,17,"“Yes, yes, I know. I just don't feel comfortable. This week has been extra challenging.” “There are always going to be challenges. They should not give you the reason to avoid trying something new.” “Yes, you're right.” Stephen said as he clutched his white cane tightly. ",891.3219986469505,0.5506544502249547
1038,2,Dont Look,4,negative,65,84,19,"“Please tell me what has been challenging about this week.” Dr. Acosta said as she finally looked up at Stephen. “Well, on Tuesday, I misplaced my cell phone and it was ringing. Susan was outside in the garden and couldn't hear the phone. It drove me nuts.” Stephen said as he ran his fingers through his dirty blonde hair.",992.4566012370732,1.0998316462378943
1038,2,Dont Look,5,negative,84,109,25,"“Susan is your new nurse, correct?” Dr. Acosta said. “Yes, she's quite nice. A little more attentive than Monica was. It doesn't normally bother me.” “Should it have bothered you?” “No.” Steven said. “Did you try locating the phone yourself?” “No.” “It stopped ringing after the fifth ring.” “I see.” Dr. Acosta said, and she went back to writing on her device. Steven didn't like the tone of her voice. ",916.8054672110007,0.6890337927276148
1038,2,Dont Look,6,negative,109,125,16,"“I did do the squinting exercises.” Steven said, trying to find something that she would approve of. “Good. What did you think?” “It was strange at first because it felt like my eyes would open whenever I released from squinting. I didn't like the sensation.” ",822.8377820728771,0.17877411386057646
1038,2,Dont Look,7,negative,125,141,16,"“This is good progress, Steven. Eventually, the strangeness will go away and the need to open your eyes will happen, especially if you start with the other lesson.” Dr. Acosta said, Steven could hear that she was smiling. Steven tightened his lips.",795.4004893543363,0.02978519122228168
1038,2,Dont Look,8,negative,141,161,20,"“I'm not sure I'm ready to open my eyes.” “It's normal to feel apprehensive about it. These sessions and lessons are here to help you get to a point where you want to open your eyes and live a normal life. Is that not what you want?” “Yes, Dr. Acosta. It is.” Stephen said as he steadied his voice.",793.445282825175,0.01916810456933182
1038,2,Dont Look,9,negative,161,181,20,"Stephen was guided out of the office and into Susan's car. He could smell her perfume as she clipped his seatbelt into place. He lowered his head as the car started. It was always a jarring feeling when he rode in one. “Do you need to stop anywhere else?” Susan said. “No, I’d like to go home and rest.”",733.719046832552,-0.3051549853603189
1038,2,Dont Look,10,negative,181,203,22,"He thought about what Dr. Acosta had said, and when she had asked him at the end of the session, Stephen couldn't remember the last time he had lied. Then it came to him, and he shuddered at the memory. The last time he had his eyes open was the last time he had lied, and it was to tell the police a different story of what had happened that night.",766.9072577220414,-0.12493764994602018
1038,2,Dont Look,11,negative,203,217,14,Stephen was 11 years old again and found himself sitting on a metal chair next to a desk. He could see the room through the slits of his eyelids. The lids kept closing on him. It felt like his face was covered in blood. ,763.4090500596656,-0.14393348150013746
1038,2,Dont Look,12,negative,217,234,17,"He felt a hand on his shoulder. “Hey, how you doing, kid? Still don't want to open your eyes?” It was Officer Brennan returning. Stephen could sense someone else was there. “Stephen, this is Dr. Coolidge. She wanted to ask you some questions.” Officer Brennan said. ",753.2371938643598,-0.1991683004495365
1038,2,Dont Look,13,negative,234,254,20,"“Hello, Stephen.” Dr. Coolidge said, as the officer grabbed an extra chair for her to sit on. “Are you in pain? Does your eyes bother you?” Dr. Coolidge said. “No, I just can't open them.” Stephen said, squirming in his seat. He decided to keep his eyes closed. He didn't want to see the doctor and officer.",702.3654503958433,-0.47541006853710926
1038,2,Dont Look,14,negative,254,266,12,"“Okay, if it makes you feel better to have your eyes closed, then do so.” Stephen nodded. “We would like to know what had happened. Take your time, and if it gets too scary, you can stop.” ",639.4692406859343,-0.8169466267843167
1038,2,Dont Look,15,negative,266,281,15,"“I was out with my friends in the woods. We have a boy's only house. Well, it's a big tent that we got from Michael's dad. We were hanging out even though it was getting late.” Stephen paused and licked his lips. ",629.5724780017975,-0.8706876436201365
1038,2,Dont Look,16,negative,281,303,22,"“Who was there with you?” Dr. Coolidge said. “It was me, Tommy, Richard, Ismael, and Michael.” “What were you all doing in the tent?” “At first, we were reading comic books and eating gummy bears.” Stephen said, as his heartbeat accelerated, he was getting to the part that he did not want to talk about. “Yes?” Dr. Coolidge pressed gently.",696.7148414289104,-0.5060937861644215
1038,2,Dont Look,17,negative,303,323,20,"“Richard took out his mom's gun from his backpack. He said that she kept the gun because she was afraid that her boyfriend would come back. He was showing it off. I didn't care about it. I just wanted to go back to reading Spider-Man comics, but...” Steven broke off. He closed his eyes tighter. “It's alright, Steven. If you don't want to say it,” Dr. Coolidge said.",667.5326850515037,-0.6645575997605065
1038,2,Dont Look,18,negative,323,340,17,"“I'll say it. Stephen shot me in the head.” Stephen recognized Richard's voice and shrunk back, falling off the chair. He could feel Richard's breath on his cheek. How could he still be alive? Stephen thought. “You shot me, liar!” Richard's voice echoed.",753.3584677089086,-0.19850976392303296
1038,2,Dont Look,19,negative,340,353,13,Stephen woke up panting. He felt cold sweat covering his body. His pajamas sticking to him as he tried to pull them off in bed. He staggered to his feet and slipped off his bottoms. Stephen grabbed his cell phone. ,730.687260315352,-0.321618074904197
1038,2,Dont Look,20,negative,353,369,16,"“Hey Siri, what time is it?” Stephen said. His cell phone answered back that it was about three in the morning. He decided to take a shower instead of going back to bed. The hot water wasn't enough to wash away the bad dream he had.",611.233232335244,-0.9702727040664408
1038,2,Dont Look,21,negative,369,388,19,"It kept playing out over and over in his mind. As the water streamed down his face, he realized that it reminded him of the blood that splattered on his face when the gun went off. Stephen staggered back onto a tiled wall and slid down. He wrapped his arms around him as he sobbed uncontrollably.",608.8758120527519,-0.9830738762410123
1038,2,Dont Look,22,negative,388,403,15,"Later that morning, Susan had arrived at around seven and had let herself in. She prepared him a breakfast of the usual, two scrambled eggs, two Canadian bacon strips, and sliced grapefruit. “Here you go, son.” Susan said. ",665.6138200472484,-0.6749773460745856
1038,2,Dont Look,23,negative,403,417,14,"“I need to take my mother to a doctor's appointment. She just turned 90 not too long ago, and I feel she should go more often than not. Will you be all right for a couple of hours?” “Yes, that's fine. I can listen to my audio book outside,” he said. ",703.8137464116523,-0.46754558769090254
1038,2,Dont Look,24,negative,417,434,17,"“Oh, that's a wonderful idea. Spring is finally starting up and you can feel the change. Well, I better get going. Unless there's anything else you need.” Susan said, “No, it's fine. Go ahead. Thank you for breakfast.” Stephen said, and he felt a squeezing hand on his shoulder.",565.3134211772064,-1.2196246814051814
1038,2,Dont Look,25,negative,434,454,20,"After eating, Stephen placed the dirty dishes in the sink. He headed back upstairs to get his earphones, which he kept in his office. His white cane smacked into the desk chair, and he rested his hands on the desk. He searched around and came across what felt like a notepad. It occurred to him that he didn't own a notepad.",603.8246618830632,-1.0105024359603034
1038,2,Dont Look,26,negative,454,467,13,"Maybe it's Susan's, but that means she's been in my office, he thought. Stephen opened it and ran his fingers over the pages. He could feel the slight indentation where writing implement was used.",914.818017337737,0.6782416195182267
1038,2,Dont Look,27,negative,467,491,24,"Closing it, he ran his fingers over the cover. There were letters, and it spelled out journal. This is definitely not mine, Stephen thought. Opening it again, he flipped a page that had pages attached to it. Newspaper clippings, he wondered. Stephen realized that if this was Susan's journal, he was being intrusive. Yet she did leave it here.",649.4962386923735,-0.7624984111531081
1038,2,Dont Look,28,negative,491,510,19,"He hadn't had this much curiosity since that night when Richard was showing off his gun. Stephen shuddered and gasped. He took out his phone from his back pocket. “Hey Siri, what day is it today?” Stephen said. Siri answered back, April 22. He almost dropped his phone.",649.3086673274042,-0.7635169539033437
1038,2,Dont Look,29,negative,510,519,9,It was 23 years ago today that Richard was shot. Somehow he had forgotten. His desire to go outside to sit and listen to his audiobook was dashed.,678.9256474789008,-0.6026919771158411
1038,2,Dont Look,30,negative,519,539,20,"Stephen knew that he should call Tommy, Ismael, and Michael. Yet he didn't want to relive the memory, not this year. Besides the sobering recount of what had happened, he would have to endure the questioning about his eyes, and the tense silence filled with hate. They never voiced it, but he knew that they hated him because of what happened. ",582.5263187856136,-1.1261558724936196
1038,2,Dont Look,31,negative,539,560,21,"Last year, Michael didn't show up at the bar to meet with them. Tommy had said that he had an emergency. Steven didn't believe it for a second. They're probably deciding to meet without me, he thought. Steven placed his phone on the desk and sat down without dialing any of them. He gripped his white cane between his legs and tightened his eyes. ",567.7484882121178,-1.2064018748475098
1038,2,Dont Look,32,negative,560,574,14,"“I don't care about Dr. Acosta's lessons. I'm never opening my eyes again. It's better this way,” Steven told himself. “It's not my fault.” Stephen said out loud, but he knew it wasn't entirely true. ",618.6338924041369,-0.9300859268290678
1038,2,Dont Look,33,negative,574,591,17,"He was jealous when Richard pulled out the gun to show it off. Richard was always the cool one in the group. His mother gave him everything, even though they were known in the neighborhood as being poor. Stephen's father once told him that Richard's mother was a drug dealer, and that he should stay away from him.",576.3355577916158,-1.1597727027060127
1038,2,Dont Look,34,negative,591,601,10,"Yet he kept hanging out with Richard, even though he hated him. Stephen didn't want to be alone. The others would never think of hanging with him without Richard. ",625.5374083997688,-0.8925987220542909
1038,2,Dont Look,35,negative,601,620,19,"So when Richard took that gun out, Stephen had it in his mind to grab the weapon and pose with it like he was an action star, but not before scaring Richard. It didn't go as planned. He was not counting on there being bullets in the gun. Richard still had the gun in his hands. It was pointed towards his face when Stephen grabbed it.",657.0096560957105,-0.7216993434120496
1038,2,Dont Look,36,negative,620,626,6,The police believed it was a mistake made by Richard and that Stephen was trying to take the gun away.,806.3051215279525,0.08899910186500652
1038,2,Dont Look,37,negative,626,641,15,"The stairs creaked, startling Stephen from his memory. He swung around in his desk chair. “Hello?” Stephen said, could it be Susan? But she said that she would be out for a couple of hours. She would have called to say that she was coming back, he wondered.",717.031103090333,-0.39577321015046174
1038,2,Dont Look,38,negative,641,648,7,"Stephen waited for the sound to return, but no sound came. Stupid old house, he thought. ",735.1936359487416,-0.2971477287403246
1038,2,Dont Look,39,negative,648,664,16,"The hairs stood up on his arms as he felt a presence. “Who’s there?” Stephen said. A breeze crossed his face as if someone had walked past him. He shrunk back in his chair. Taking his white cane, he swung it back and forth. It didn't hit anything.",785.3333432221993,-0.024881035203760865
1038,2,Dont Look,40,negative,664,678,14,"Suddenly, someone grabbed it and yanked it. Stephen hopped up to his feet and was dragged. He was being pulled out of the office. Just as he was about to pull it back, the person let go. Stephen caught a whiff of the perfume. ",822.1919341272147,0.17526705539823167
1038,2,Dont Look,41,negative,678,692,14,"“Susan?” Before Stephen could turn around and confront the voice, he was pushed from behind. His eyes were forced open as his body went airborne and slammed into the staircase. He saw everything.",1003.3818455321292,1.1591574840229255
1038,2,Dont Look,42,negative,692,710,18,"Stephen's body lay in a crumbled heap at the bottom. Susan checked his pulse with a gloved hand. She smirked and took note of the white cane nearby. After grabbing her journal with the newspaper clippings and cleaning up, she left without so much as a backward glance.",1047.3273924528976,1.3977888882813894
1038,2,Pool Party,43,positive,712,724,12,[applause],997.0078189107599,1.124545491909582
1038,2,Pool Party,44,positive,724,747,23,"So, like many other younger children, when I was little, I lived what I call a phase-to-phase lifestyle. And this was pretty much, I was defined by whatever phase I was in. And these phases would be like TV shows or books or something that I just become obsessed with and devote my entire existence to and then have that whole thing completely shift in like a week. ",949.8883657791599,0.8686792652596497
1038,2,Pool Party,45,positive,747,755,8,And this would become a big dilemma come birthday time when grandma was getting me hot wheels when I had already fully transitioned into Power Rangers territory.,1115.2966169997135,1.7668727349156943
1038,2,Pool Party,46,positive,755,771,16,"But there was something different to my phases and that was that I had this theme to them like this overarching theme and that was the color red. And it wasn't anything satanic or it was just, I really love the color red and all characters and things associated with it.",988.0425723273597,1.0758627576708348
1038,2,Pool Party,47,positive,771,796,25,"I remember I was five years old and in the back seat of a rental car that my dad was driving and my whole family was in, and my mom and my brother. And I was just sitting there and I was just thinking, why do I have to be in this car when I have the ability of super speed? And this was during my superhero phase, of course, I gravitated towards the red flash. But this time, I actually thought I had his superpowers and I could run and get to our destination.",881.7538281553833,0.49869774196726263
1038,2,Pool Party,48,positive,796,818,22,And we were headed to my uncle's pool party in New Jersey. And it was a very exciting time. It was an annual summer pool party. And it was so different for me. It was this new world. It was suburbia. It was staying up late and going to the mall. And there was a pool table and a ping pong table and a pool for the pool party.,867.535950494964,0.4214923742016048
1038,2,Pool Party,49,positive,818,831,13,"And there was also Michael. Now, Michael was always introduced to me as Uncle Dan's partner. So I thought my Uncle Dan was in the FBI or something.",954.5745281806975,0.8941258825580599
1038,2,Pool Party,50,positive,831,848,17,"But I was told to call him Uncle Michael, which kind of confused me because he wasn't my uncle. I always defined family, defined my uncles and aunts as people who were related to me by blood or by marriage and Michael was neither. ",891.5380363119307,0.5518275695733129
1038,2,Pool Party,51,positive,848,870,22,"But I had no problem calling him Uncle Michael because he was like an uncle to me. He was amazing. He was the adult who would actually pay attention to my brother and I when we were little. All the other adults would just come up to us and be like, wow, you grew up so quickly. But Uncle Michael would actually play with us and talk with us and really make all these family gatherings so special for my brother and I.",915.9769295635436,0.6845346997330467
1038,2,Pool Party,52,positive,870,884,14,"So we're at the pool party and my brother and I, we just want to get into the pool. Like that's our goal. We live in the city. We don't really get to do that that much. So the second we're in there, we jump in the pool and we're having some fun.",752.7894943918867,-0.20159938075887143
1038,2,Pool Party,53,positive,884,905,21,"I'm staying in the shallow end, but my brother, who just kind of learned to swim, is swimming all around. He's very excited. This is his new skill that I don't possess. And I'm just sitting there, and I'm waiting for Uncle Michael to get in the pool, because once Uncle Michael's in the pool, that means splash fights, that means diving contests, that means a really fun time.",752.8336228305111,-0.20135975622317823
1038,2,Pool Party,54,positive,905,918,13,But he's all the way at the other end of the backyard and he's grilling everything and I'm just waiting there watching my brother flex on me and swim all over the place. And I'm getting really envious and then it hits me. ,811.9803483861838,0.11981649861072921
1038,2,Pool Party,55,positive,918,935,17,"Today, I have the abilities of the Flash. I have super speed. And if I put my super speed to work, I could probably use it and get to the deep end of that pool. If I'm moving super quickly, if my body's going, I'm going to float. I'm going to make it. I'm going to develop buoyancy.",846.8616889608071,0.309227801165399
1038,2,Pool Party,56,positive,935,952,17,"So I'm getting impatient. I'm not waiting for Uncle Michael and I decide to take off and I think I'm going really quickly like I'm running. I'm using all my force, but I'm a puny little five year old and I'm in water. So I'm moving very slowly and I'm running.",922.8457582462454,0.7218335468066576
1038,2,Pool Party,57,positive,952,960,8,"And the way this pool is set up is there's a very shallow end, which I can stand in and then a steep incline and then a very deep end that I cannot swim in.",846.4500938526558,0.3069927733747299
1038,2,Pool Party,58,positive,960,988,28,"So I take off and I'm running and the second I hit the ramp, I slide in and I lose all my power and I'm trying to break the surface of the water and I'm swimming up. and trying to break it but I can't and I'm getting tired and my eyes are sort of closing and this is a sensation known as drowning. So I'm drowning. and I'm in the pool drowning and I'm trying to call for help but no one can really hear me and my eyes are really coming down now",1062.884207456835,1.4822649016729597
1038,2,Pool Party,59,positive,988,1004,16,and all of a sudden I feel something grab me all around my stomach and pull me out of the pool and pull me onto the surface of the concrete that was right by the pool and open my eyes for a little second and I see Uncle Michael's face.,1137.5267863671943,1.8875861383153552
1038,2,Pool Party,60,positive,1004,1016,12,"And then he pulled me into the house and put me in the master bed, which was like temperpedic with a really nice warm pillow. And I fell right to sleep.",938.1328366858821,0.8048448471697391
1038,2,Pool Party,61,positive,1016,1036,20,"Now, recently my biological uncle and Uncle Michael broke up. And this was really rough for me because it meant I really wouldn't get to see him. These pool parties would no longer have Uncle Michael at them, which was a really rough thing for me you know, he was such an influential part of my life. ",984.422103567413,1.056203028647149
1038,2,Pool Party,62,positive,1036,1060,24,But he will forever change my definition of family. My definition of family is no longer related by blood or by marriage. It's someone who would run from the backyard and ruin his really nicely picked out summer outfit just because he saw that red bathing suit going up and down and he thought maybe there's a chance that David's in trouble and he jumped in and he saved my life.,885.8411275054814,0.5208924363534113
1038,2,Pool Party,63,positive,1060,1079,19,"And I'll also never forget waking up on that summer day to a red Clifford the dog plate with a hot dog on it with a line of red tomato ketchup and a red post-it on it with writing on it that said, here I come to save the day. Love, Uncle Michael. Thank you.",979.3869072029618,1.0288611006622166
1038,2,Pool Party,64,positive,1079,1086,7,[applause],953.4791397104383,0.8881777465765517
1038,2,Grandfather Clocks,65,neutral,1088,1092,4,[music],1058.1491052617148,1.456552533405793
1038,2,Grandfather Clocks,66,neutral,1092,1100,8,"Hey, and welcome to Short Stuff, the very brief podcast on Josh. There's Chuck. That's Jerry. Let's get going. No time for laughing, Chuck. ",1178.4852294050013,2.1099970869371614
1038,2,Grandfather Clocks,67,neutral,1100,1125,25,"Welcome, everybody. And just as a very quick explanation, we had this idea because we often come across cool little interesting tidbits that certainly don't warrant a 45 minute episode. And everyone else on the planet is doing little shorty episodes on their podcast. And we thought, well, hey, in your tin, why don't we give it a shot? Yeah, let's try something new for once. Yeah. So I hope you all like it.",895.0321066997695,0.5708009350597225
1038,2,Grandfather Clocks,68,neutral,1125,1132,7,"Great. Well, we've just wasted a lot of time, Chuck. We might not get to the end of this episode now. I thought we agreed there was no ticking clock. ",875.0608250814647,0.46235365629425895
1038,2,Grandfather Clocks,69,neutral,1132,1147,15,"So you've seen a grandfather clock before, right? Yeah, we had, you know, not the, what is the like the smaller version called that hangs on the wall? Actually, I saw those called wag on the wall clocks. Those are the original ones. ",982.0306368786758,1.0432169789980315
1038,2,Grandfather Clocks,70,neutral,1147,1167,20,"Okay, we had one of those growing up. Or it's just like an exposed pendulum swinging back and forth. Yeah, you know, three-ish feet. Three-ish feet in length? Yeah. Oh, okay. I thought you meant like off the wall. No, yeah. That sounds dangerous. My dad rigged up a hovering mechanism. It was pretty advanced. Right. And the pendulum was super sharp, so you better watch out. ",1029.8595329367563,1.3029355951083235
1038,2,Grandfather Clocks,71,neutral,1167,1186,19,"But you're familiar with the kind that are tall and stand on the floor. Yeah. So those are actually, you know and love them as grandfather clocks. Sure. But the name grandfather clock didn't come around until about 200 years after grandfather clocks were invented.",832.7005401422541,0.23233048015635374
1038,2,Grandfather Clocks,72,neutral,1186,1203,17,"Yeah, and it's funny when I saw this that they were invented about 350 years ago and when I saw that they were originally called long case clocks I immediately would like to that name better. Long case better than grandfather. Okay. Yeah, I think it's cool. I'm ambivalent toward both.",904.2237586565907,0.6207130869750442
1038,2,Grandfather Clocks,73,neutral,1203,1226,23,I like the I do like cuckoo clocks for sure. But the name grandfather clock will we'll find out where it came from but the grandfather clock itself or the long case clock was actually one of the first clocks. And it kind of makes sense because if you think about it when you start out inventing something new it's huge. It's enormous.,1239.0694809781608,2.4389793397901496
1038,2,Grandfather Clocks,74,neutral,1226,1239,13,"And then as you get better at it over time and find like workarounds and shortcuts and stuff, you can make it smaller and smaller. So it makes sense that some of the first actually precise clocks were giant grandfather clocks. ",975.1964821889351,1.0061064172960072
1038,2,Grandfather Clocks,75,neutral,1239,1248,9,"And again, they were originally, they just had the pendulum swinging back and forth. You could mount them on the wall. They were called wag on the wall clocks. ",970.1903677700268,0.9789224089636849
