subject,group,story,event_num,valence,event_start_sec,event_end_sec,event_duration_sec,transcript,mean_pupil_size,z_pupil
1041,2,Grandfather Clocks,76,neutral,1248,1276,28,"And the first person who really tried to invent this thing was none other than Galileo Galilei. Yeah, he's the one that discovered, hey, a pendulum swings at a constant rate, regardless of its size. I think we've got something here, boys. And unfortunately, he died before he could actually make a legit clock. Yeah, but he tried for like his whole life. Yeah. That's what killed him. It was the sharp pendulum. He's like, I regret everything.",415.76146533332906,-1.0301573625812002
1041,2,Grandfather Clocks,77,neutral,1276,1291,15,"But a Dutch astronomer named Christiaan Huygens built the very first pendulum clock in the, what, 1657. And this is when, like apparently this is the most accurate timepiece ever in the history of the world.",419.2607119987398,-0.9956484926114545
1041,2,Grandfather Clocks,78,neutral,1291,1308,17,"Yeah, before that it was, the clocks were accurate within 15 minutes every 24 hours. It's pretty good. Sure, for the early 17th century. But then Huygens comes along and his was accurate within a minute every 24 hours. That's great.",510.00511281340187,-0.10074538127903739
1041,2,Grandfather Clocks,79,neutral,1308,1326,18,"Finally, what he had produced was something that you could actually use for like scientific purposes, which again, as you said, he was an astronomer and you need precise clocks for astronomy. So he kind of made a scientific instrument for himself more than, you know, let's make something that everybody sets their watch to.",480.6294114827481,-0.3904426659860662
1041,2,Grandfather Clocks,80,neutral,1326,1337,11,"Yeah, so his wasn't a long case clock though, but because people like to invent and build on others' work, of course it’s got bigger and bigger.",500.0751081313156,-0.19867309919624765
1041,2,Grandfather Clocks,81,neutral,1337,1350,13,"And eventually in London, and what, not even too many years later, three or four years later, the very first long case clocks started, like six feet tall, started to be released for purchase.",483.7175559647208,-0.3599880034355267
1041,2,Grandfather Clocks,82,neutral,1350,1368,18,"Yeah, and there was a dude named Clement. I can't remember his first name, but he basically made the pendulum so precise that all of a sudden there was a clock that was accurate within a second over 24 hours. And so they added minute hands and second hands and really started to show off.",444.5992756678429,-0.7457646511776688
1041,2,Grandfather Clocks,83,neutral,1368,1395,27,"But at the time, in the late 17th, early 18th centuries, You had to literally be royalty to afford a clock like this. And then over time, again, as they figured out shortcuts and there were improvements in manufacturing, you just had to be somewhat rich to afford them. And they started to spread and they started to kind of encase them in wood. They started really kind of tricking them out and everything. They made the pendulum look really beautiful.",370.23805458033377,-1.479100124399918
1041,2,Grandfather Clocks,84,neutral,1395,1423,28,"And then what you know and love as a grandfather clock really kind of was developed between, I think, Up to about 1850, I think, right? From the late 17th century up to 1850. That sounds about right. And then that was like kind of the golden age of the grandfather clock. And then they just stopped progressing. They said, this is perfect. This is the grandfather clock, although we don't call it that yet. And we're going to just leave it as is and say, we're happy with this model.",420.9696695222297,-0.9787950956946614
1041,2,Grandfather Clocks,85,neutral,1423,1446,23,"Yeah, so put a pin in that and then we switch on over to the story of a man named Henry Clay Work who was born in Connecticut in 1832. He was a musician, a singer-songwriter, very emo from what I understand. A little bit, I got that too. And it was back in the days when you would write like war songs.",337.983417260515,-1.7971888993906573
1041,2,Grandfather Clocks,86,neutral,1446,1467,21,That doesn't happen much today unless you count like Toby Keith Whatever work he's doing right whatever good work he's doing. But he was a champion of the north and he had a song called Kingdom Coming a pro-union ballad which gave him a music contract with a publishing firm named Root and Katie or Caddy?,430.6649470461258,-0.8831822100127495
1041,2,Grandfather Clocks,87,neutral,1467,1484,17,"And he started pumping out hits over like the next decade or so until hard times fell. He made some bad financial moves. Two of his kids died in the 1870s. And so he kind of fell on hard times. But he would come back with a big, big hit called grandfather's clock.",401.0477171618759,-1.1752614009547455
1041,2,Grandfather Clocks,88,neutral,1484,1516,32,"Right. And this is actually where the name grandfather clock comes from. It's from this guy's song. And it's a pretty sweet song, actually. It's very sad. He basically sings about how his grandfather, his great-grandparents bought a long-case clock on the day his grandfather was born. Yeah. What a great baby gift. Right, exactly. Here you go, kid. Maybe someday you'll be this tall. Who knows? Here's a grandfather, a long-case clock and a wooby. Right, exactly. Don't let it fall on you.",402.20599695071775,-1.1638386775963634
1041,2,Grandfather Clocks,89,neutral,1516,1536,20,"But they, so they bought, yeah, I guess now that you pointed out it’s a weird baby gift, but it was a great sturdy, reliable clock and it worked through the grandfather's whole life until, until the day he died and the day that the grandfather died, the clock stopped as well and it still hasn't worked since.",427.6040865515201,-0.9133678033428734
1041,2,Grandfather Clocks,90,neutral,1536,1551,15,"Yeah, here's the lyric. My grandfather's clock was too large for the shelf, so it stood 90 years on the floor. It was bought on the morn’ of the day he was born, and was always his treasure and pride, but it stopped short, never to go again when the old man died. ",442.63697196146296,-0.765116497423314
1041,2,Grandfather Clocks,91,neutral,1551,1566,15,"Yeah, and America was like, oh, God, this is the greatest song anyone will ever write. We can just stop. We can stop improving on grandfather clocks. We can stop writing songs now. And the two come together in this writing by Work, or this song by Henry Clay Work, right?",379.08435027734106,-1.3918597275054876
1041,2,Grandfather Clocks,92,neutral,1566,1585,19,"Yeah, it was a big, big hit. He sold close to a million copies, made the equivalent of about $95,000 on the song. Johnny Cash would record it. Prairie Home Companion spoofed it. I think Skrillex. Just kidding. Remixed it. It was in a video game called Five Nights at Freddy's. ",410.6037842315142,-1.0810213808989975
1041,2,Grandfather Clocks,93,neutral,1585,1601,16,"Yeah, and if you look it up in the OED, the Oxford English Dictionary, if you look up grandfather clock, it attributes the etymology of that term to Work. Yeah. Henry Clay Work. ",474.7745056273255,-0.44818257522054855
1041,2,Grandfather Clocks,94,neutral,1601,1623,22,"But his name does not stick to the brain. No. Even having Henry Clay in it. I know. You think that would do it for us. Yeah, but Henry Clay Work, it just does not stick. So it was a huge deal and there's, it's pretty much undisputed. I think it's 100% undisputed that Henry Clay Work was the person who came up with this song that later became the name for long case clocks, grandfather clocks. Right.",418.7515052160633,-1.0006701879451365
