subject,group,story,event_num,valence,event_start_sec,event_end_sec,event_duration_sec,transcript,mean_pupil_size,z_pupil
1041,2,Dont Look,1,negative,0,27,27,[music],667.9792177056205,1.4571636104475123
1041,2,Dont Look,2,negative,27,48,21,"“How are you feeling today, Stephen?” Dr. Acosta said. “I'm fine.” Stephen said as he adjusted himself on the overplushed chair. “Good. How is the progress going?” “Um, I haven't exactly started.” “Stephen, you know things won't get better unless you try.” Dr. Acosta said as she tapped away on her iPad. ",643.6019696838982,1.2167600714466085
1041,2,Dont Look,3,negative,48,65,17,"“Yes, yes, I know. I just don't feel comfortable. This week has been extra challenging.” “There are always going to be challenges. They should not give you the reason to avoid trying something new.” “Yes, you're right.” Stephen said as he clutched his white cane tightly. ",590.5012589261858,0.693091494163308
1041,2,Dont Look,4,negative,65,84,19,"“Please tell me what has been challenging about this week.” Dr. Acosta said as she finally looked up at Stephen. “Well, on Tuesday, I misplaced my cell phone and it was ringing. Susan was outside in the garden and couldn't hear the phone. It drove me nuts.” Stephen said as he ran his fingers through his dirty blonde hair.",585.6462858485329,0.6452127217694011
1041,2,Dont Look,5,negative,84,109,25,"“Susan is your new nurse, correct?” Dr. Acosta said. “Yes, she's quite nice. A little more attentive than Monica was. It doesn't normally bother me.” “Should it have bothered you?” “No.” Steven said. “Did you try locating the phone yourself?” “No.” “It stopped ringing after the fifth ring.” “I see.” Dr. Acosta said, and she went back to writing on her device. Steven didn't like the tone of her voice. ",554.5698032713111,0.33874267295146965
1041,2,Dont Look,6,negative,109,125,16,"“I did do the squinting exercises.” Steven said, trying to find something that she would approve of. “Good. What did you think?” “It was strange at first because it felt like my eyes would open whenever I released from squinting. I didn't like the sensation.” ",560.124687239128,0.39352382640294153
1041,2,Dont Look,7,negative,125,141,16,"“This is good progress, Steven. Eventually, the strangeness will go away and the need to open your eyes will happen, especially if you start with the other lesson.” Dr. Acosta said, Steven could hear that she was smiling. Steven tightened his lips.",620.71505983404,0.9910539490903142
1041,2,Dont Look,8,negative,141,161,20,"“I'm not sure I'm ready to open my eyes.” “It's normal to feel apprehensive about it. These sessions and lessons are here to help you get to a point where you want to open your eyes and live a normal life. Is that not what you want?” “Yes, Dr. Acosta. It is.” Stephen said as he steadied his voice.",582.804467477947,0.617187278008159
1041,2,Dont Look,9,negative,161,181,20,"Stephen was guided out of the office and into Susan's car. He could smell her perfume as she clipped his seatbelt into place. He lowered his head as the car started. It was always a jarring feeling when he rode in one. “Do you need to stop anywhere else?” Susan said. “No, I’d like to go home and rest.”",541.2356806739169,0.20724422575066
1041,2,Dont Look,10,negative,181,203,22,"He thought about what Dr. Acosta had said, and when she had asked him at the end of the session, Stephen couldn't remember the last time he had lied. Then it came to him, and he shuddered at the memory. The last time he had his eyes open was the last time he had lied, and it was to tell the police a different story of what had happened that night.",521.1629146464995,0.009290626303000577
1041,2,Dont Look,11,negative,203,217,14,Stephen was 11 years old again and found himself sitting on a metal chair next to a desk. He could see the room through the slits of his eyelids. The lids kept closing on him. It felt like his face was covered in blood. ,514.6720348001987,-0.054721131090199625
1041,2,Dont Look,12,negative,217,234,17,"He felt a hand on his shoulder. “Hey, how you doing, kid? Still don't want to open your eyes?” It was Officer Brennan returning. Stephen could sense someone else was there. “Stephen, this is Dr. Coolidge. She wanted to ask you some questions.” Officer Brennan said. ",496.28564619442733,-0.2360440140642989
1041,2,Dont Look,13,negative,234,254,20,"“Hello, Stephen.” Dr. Coolidge said, as the officer grabbed an extra chair for her to sit on. “Are you in pain? Does your eyes bother you?” Dr. Coolidge said. “No, I just can't open them.” Stephen said, squirming in his seat. He decided to keep his eyes closed. He didn't want to see the doctor and officer.",528.6220390989821,0.08285101813341109
1041,2,Dont Look,14,negative,254,266,12,"“Okay, if it makes you feel better to have your eyes closed, then do so.” Stephen nodded. “We would like to know what had happened. Take your time, and if it gets too scary, you can stop.” ",436.6388007951493,-0.824269260468185
1041,2,Dont Look,15,negative,266,281,15,"“I was out with my friends in the woods. We have a boy's only house. Well, it's a big tent that we got from Michael's dad. We were hanging out even though it was getting late.” Stephen paused and licked his lips. ",475.09285643273995,-0.4450430633200572
1041,2,Dont Look,16,negative,281,303,22,"“Who was there with you?” Dr. Coolidge said. “It was me, Tommy, Richard, Ismael, and Michael.” “What were you all doing in the tent?” “At first, we were reading comic books and eating gummy bears.” Stephen said, as his heartbeat accelerated, he was getting to the part that he did not want to talk about. “Yes?” Dr. Coolidge pressed gently.",541.1936546267574,0.20682977328833246
1041,2,Dont Look,17,negative,303,323,20,"“Richard took out his mom's gun from his backpack. He said that she kept the gun because she was afraid that her boyfriend would come back. He was showing it off. I didn't care about it. I just wanted to go back to reading Spider-Man comics, but...” Steven broke off. He closed his eyes tighter. “It's alright, Steven. If you don't want to say it,” Dr. Coolidge said.",548.3264469815415,0.277171943311819
1041,2,Dont Look,18,negative,323,340,17,"“I'll say it. Stephen shot me in the head.” Stephen recognized Richard's voice and shrunk back, falling off the chair. He could feel Richard's breath on his cheek. How could he still be alive? Stephen thought. “You shot me, liar!” Richard's voice echoed.",536.3747245086073,0.15930644934425922
1041,2,Dont Look,19,negative,340,353,13,Stephen woke up panting. He felt cold sweat covering his body. His pajamas sticking to him as he tried to pull them off in bed. He staggered to his feet and slipped off his bottoms. Stephen grabbed his cell phone. ,512.92288036084,-0.07197094194277259
1041,2,Dont Look,20,negative,353,369,16,"“Hey Siri, what time is it?” Stephen said. His cell phone answered back that it was about three in the morning. He decided to take a shower instead of going back to bed. The hot water wasn't enough to wash away the bad dream he had.",490.870086685576,-0.28945117759800604
1041,2,Dont Look,21,negative,369,388,19,"It kept playing out over and over in his mind. As the water streamed down his face, he realized that it reminded him of the blood that splattered on his face when the gun went off. Stephen staggered back onto a tiled wall and slid down. He wrapped his arms around him as he sobbed uncontrollably.",519.4065167770258,-0.008030617807035104
1041,2,Dont Look,22,negative,388,403,15,"Later that morning, Susan had arrived at around seven and had let herself in. She prepared him a breakfast of the usual, two scrambled eggs, two Canadian bacon strips, and sliced grapefruit. “Here you go, son.” Susan said. ",466.56573147848155,-0.529135862256178
1041,2,Dont Look,23,negative,403,417,14,"“I need to take my mother to a doctor's appointment. She just turned 90 not too long ago, and I feel she should go more often than not. Will you be all right for a couple of hours?” “Yes, that's fine. I can listen to my audio book outside,” he said. ",497.4022943582657,-0.22503185345591545
1041,2,Dont Look,24,negative,417,434,17,"“Oh, that's a wonderful idea. Spring is finally starting up and you can feel the change. Well, I better get going. Unless there's anything else you need.” Susan said, “No, it's fine. Go ahead. Thank you for breakfast.” Stephen said, and he felt a squeezing hand on his shoulder.",584.5372108744383,0.6342752464419117
1041,2,Dont Look,25,negative,434,454,20,"After eating, Stephen placed the dirty dishes in the sink. He headed back upstairs to get his earphones, which he kept in his office. His white cane smacked into the desk chair, and he rested his hands on the desk. He searched around and came across what felt like a notepad. It occurred to him that he didn't own a notepad.",460.76963178013284,-0.5862958369441927
1041,2,Dont Look,26,negative,454,467,13,"Maybe it's Susan's, but that means she's been in my office, he thought. Stephen opened it and ran his fingers over the pages. He could feel the slight indentation where writing implement was used.",547.717969907626,0.27117126424255483
1041,2,Dont Look,27,negative,467,491,24,"Closing it, he ran his fingers over the cover. There were letters, and it spelled out journal. This is definitely not mine, Stephen thought. Opening it again, he flipped a page that had pages attached to it. Newspaper clippings, he wondered. Stephen realized that if this was Susan's journal, he was being intrusive. Yet she did leave it here.",517.6083075785449,-0.025764196871971855
1041,2,Dont Look,28,negative,491,510,19,"He hadn't had this much curiosity since that night when Richard was showing off his gun. Stephen shuddered and gasped. He took out his phone from his back pocket. “Hey Siri, what day is it today?” Stephen said. Siri answered back, April 22. He almost dropped his phone.",524.2793363497542,0.040024153147952324
1041,2,Dont Look,29,negative,510,519,9,It was 23 years ago today that Richard was shot. Somehow he had forgotten. His desire to go outside to sit and listen to his audiobook was dashed.,530.8879112096023,0.10519659519900706
1041,2,Dont Look,30,negative,519,539,20,"Stephen knew that he should call Tommy, Ismael, and Michael. Yet he didn't want to relive the memory, not this year. Besides the sobering recount of what had happened, he would have to endure the questioning about his eyes, and the tense silence filled with hate. They never voiced it, but he knew that they hated him because of what happened. ",452.09504412059084,-0.6718428835537685
1041,2,Dont Look,31,negative,539,560,21,"Last year, Michael didn't show up at the bar to meet with them. Tommy had said that he had an emergency. Steven didn't believe it for a second. They're probably deciding to meet without me, he thought. Steven placed his phone on the desk and sat down without dialing any of them. He gripped his white cane between his legs and tightened his eyes. ",440.44337991817855,-0.7867492629372835
1041,2,Dont Look,32,negative,560,574,14,"“I don't care about Dr. Acosta's lessons. I'm never opening my eyes again. It's better this way,” Steven told himself. “It's not my fault.” Stephen said out loud, but he knew it wasn't entirely true. ",454.48410215908433,-0.6482824715326656
1041,2,Dont Look,33,negative,574,591,17,"He was jealous when Richard pulled out the gun to show it off. Richard was always the cool one in the group. His mother gave him everything, even though they were known in the neighborhood as being poor. Stephen's father once told him that Richard's mother was a drug dealer, and that he should stay away from him.",490.7959400931933,-0.29018239644591604
1041,2,Dont Look,34,negative,591,601,10,"Yet he kept hanging out with Richard, even though he hated him. Stephen didn't want to be alone. The others would never think of hanging with him without Richard. ",464.23088034898245,-0.5521616965944786
1041,2,Dont Look,35,negative,601,620,19,"So when Richard took that gun out, Stephen had it in his mind to grab the weapon and pose with it like he was an action star, but not before scaring Richard. It didn't go as planned. He was not counting on there being bullets in the gun. Richard still had the gun in his hands. It was pointed towards his face when Stephen grabbed it.",449.8538307861289,-0.6939452807062505
1041,2,Dont Look,36,negative,620,626,6,The police believed it was a mistake made by Richard and that Stephen was trying to take the gun away.,470.77545652173905,-0.4876203967812391
1041,2,Dont Look,37,negative,626,641,15,"The stairs creaked, startling Stephen from his memory. He swung around in his desk chair. “Hello?” Stephen said, could it be Susan? But she said that she would be out for a couple of hours. She would have called to say that she was coming back, he wondered.",507.42596033758997,-0.1261804665788881
1041,2,Dont Look,38,negative,641,648,7,"Stephen waited for the sound to return, but no sound came. Stupid old house, he thought. ",438.6430034602449,-0.8045042150809988
1041,2,Dont Look,39,negative,648,664,16,"The hairs stood up on his arms as he felt a presence. “Who’s there?” Stephen said. A breeze crossed his face as if someone had walked past him. He shrunk back in his chair. Taking his white cane, he swung it back and forth. It didn't hit anything.",495.2731203456987,-0.2460293412491948
1041,2,Dont Look,40,negative,664,678,14,"Suddenly, someone grabbed it and yanked it. Stephen hopped up to his feet and was dragged. He was being pulled out of the office. Just as he was about to pull it back, the person let go. Stephen caught a whiff of the perfume. ",544.2102072660307,0.2365784114208079
1041,2,Dont Look,41,negative,678,692,14,"“Susan?” Before Stephen could turn around and confront the voice, he was pushed from behind. His eyes were forced open as his body went airborne and slammed into the staircase. He saw everything.",665.4703362904947,1.432421524277967
1041,2,Dont Look,42,negative,692,710,18,"Stephen's body lay in a crumbled heap at the bottom. Susan checked his pulse with a gloved hand. She smirked and took note of the white cane nearby. After grabbing her journal with the newspaper clippings and cleaning up, she left without so much as a backward glance.",679.0027901000602,1.565875874181897
1041,2,Pool Party,43,positive,712,724,12,[applause],653.908665022202,1.3184026371917008
1041,2,Pool Party,44,positive,724,747,23,"So, like many other younger children, when I was little, I lived what I call a phase-to-phase lifestyle. And this was pretty much, I was defined by whatever phase I was in. And these phases would be like TV shows or books or something that I just become obsessed with and devote my entire existence to and then have that whole thing completely shift in like a week. ",585.6701334956896,0.6454479024907116
1041,2,Pool Party,45,positive,747,755,8,And this would become a big dilemma come birthday time when grandma was getting me hot wheels when I had already fully transitioned into Power Rangers territory.,630.1527994684873,1.0841270476725855
1041,2,Pool Party,46,positive,755,771,16,"But there was something different to my phases and that was that I had this theme to them like this overarching theme and that was the color red. And it wasn't anything satanic or it was just, I really love the color red and all characters and things associated with it.",590.7240968811404,0.6952890774568403
1041,2,Pool Party,47,positive,771,796,25,"I remember I was five years old and in the back seat of a rental car that my dad was driving and my whole family was in, and my mom and my brother. And I was just sitting there and I was just thinking, why do I have to be in this car when I have the ability of super speed? And this was during my superhero phase, of course, I gravitated towards the red flash. But this time, I actually thought I had his superpowers and I could run and get to our destination.",524.1639693401174,0.03888642679853351
1041,2,Pool Party,48,positive,796,818,22,And we were headed to my uncle's pool party in New Jersey. And it was a very exciting time. It was an annual summer pool party. And it was so different for me. It was this new world. It was suburbia. It was staying up late and going to the mall. And there was a pool table and a ping pong table and a pool for the pool party.,565.7094034754267,0.44859917971294855
1041,2,Pool Party,49,positive,818,831,13,"And there was also Michael. Now, Michael was always introduced to me as Uncle Dan's partner. So I thought my Uncle Dan was in the FBI or something.",507.8994289083875,-0.12151121433499244
1041,2,Pool Party,50,positive,831,848,17,"But I was told to call him Uncle Michael, which kind of confused me because he wasn't my uncle. I always defined family, defined my uncles and aunts as people who were related to me by blood or by marriage and Michael was neither. ",488.9701589786731,-0.30818788422618326
1041,2,Pool Party,51,positive,848,870,22,"But I had no problem calling him Uncle Michael because he was like an uncle to me. He was amazing. He was the adult who would actually pay attention to my brother and I when we were little. All the other adults would just come up to us and be like, wow, you grew up so quickly. But Uncle Michael would actually play with us and talk with us and really make all these family gatherings so special for my brother and I.",540.1294618289762,0.19633491699701133
1041,2,Pool Party,52,positive,870,884,14,"So we're at the pool party and my brother and I, we just want to get into the pool. Like that's our goal. We live in the city. We don't really get to do that that much. So the second we're in there, we jump in the pool and we're having some fun.",495.7546886948998,-0.24128021061247956
1041,2,Pool Party,53,positive,884,905,21,"I'm staying in the shallow end, but my brother, who just kind of learned to swim, is swimming all around. He's very excited. This is his new skill that I don't possess. And I'm just sitting there, and I'm waiting for Uncle Michael to get in the pool, because once Uncle Michael's in the pool, that means splash fights, that means diving contests, that means a really fun time.",437.6547388980437,-0.814250282315932
1041,2,Pool Party,54,positive,905,918,13,But he's all the way at the other end of the backyard and he's grilling everything and I'm just waiting there watching my brother flex on me and swim all over the place. And I'm getting really envious and then it hits me. ,414.0171700844008,-1.0473592530706908
1041,2,Pool Party,55,positive,918,935,17,"Today, I have the abilities of the Flash. I have super speed. And if I put my super speed to work, I could probably use it and get to the deep end of that pool. If I'm moving super quickly, if my body's going, I'm going to float. I'm going to make it. I'm going to develop buoyancy.",431.20050078070574,-0.8779006863147735
1041,2,Pool Party,56,positive,935,952,17,"So I'm getting impatient. I'm not waiting for Uncle Michael and I decide to take off and I think I'm going really quickly like I'm running. I'm using all my force, but I'm a puny little five year old and I'm in water. So I'm moving very slowly and I'm running.",435.34018656408733,-0.8370759339969623
1041,2,Pool Party,57,positive,952,960,8,"And the way this pool is set up is there's a very shallow end, which I can stand in and then a steep incline and then a very deep end that I cannot swim in.",469.4676772145028,-0.500517454456149
1041,2,Pool Party,58,positive,960,988,28,"So I take off and I'm running and the second I hit the ramp, I slide in and I lose all my power and I'm trying to break the surface of the water and I'm swimming up. and trying to break it but I can't and I'm getting tired and my eyes are sort of closing and this is a sensation known as drowning. So I'm drowning. and I'm in the pool drowning and I'm trying to call for help but no one can really hear me and my eyes are really coming down now",592.318450207267,0.7110122707261193
1041,2,Pool Party,59,positive,988,1004,16,and all of a sudden I feel something grab me all around my stomach and pull me out of the pool and pull me onto the surface of the concrete that was right by the pool and open my eyes for a little second and I see Uncle Michael's face.,621.7950010095574,1.001704112729616
1041,2,Pool Party,60,positive,1004,1016,12,"And then he pulled me into the house and put me in the master bed, which was like temperpedic with a really nice warm pillow. And I fell right to sleep.",516.7501472607188,-0.03422720209929286
1041,2,Pool Party,61,positive,1016,1036,20,"Now, recently my biological uncle and Uncle Michael broke up. And this was really rough for me because it meant I really wouldn't get to see him. These pool parties would no longer have Uncle Michael at them, which was a really rough thing for me you know, he was such an influential part of my life. ",533.8560840399444,0.13446812134275962
1041,2,Pool Party,62,positive,1036,1060,24,But he will forever change my definition of family. My definition of family is no longer related by blood or by marriage. It's someone who would run from the backyard and ruin his really nicely picked out summer outfit just because he saw that red bathing suit going up and down and he thought maybe there's a chance that David's in trouble and he jumped in and he saved my life.,538.3243294086319,0.17853306250427523
1041,2,Pool Party,63,positive,1060,1079,19,"And I'll also never forget waking up on that summer day to a red Clifford the dog plate with a hot dog on it with a line of red tomato ketchup and a red post-it on it with writing on it that said, here I come to save the day. Love, Uncle Michael. Thank you.",534.004000614508,0.1359268449841761
1041,2,Pool Party,64,positive,1079,1086,7,[applause],548.0008523042645,0.2739609937974402
1041,2,Grandfather Clocks,65,neutral,1088,1092,4,[music],680.9415385638297,1.584995423341319
1041,2,Grandfather Clocks,66,neutral,1092,1100,8,"Hey, and welcome to Short Stuff, the very brief podcast on Josh. There's Chuck. That's Jerry. Let's get going. No time for laughing, Chuck. ",612.1229434560275,0.9063202177461853
1041,2,Grandfather Clocks,67,neutral,1100,1125,25,"Welcome, everybody. And just as a very quick explanation, we had this idea because we often come across cool little interesting tidbits that certainly don't warrant a 45 minute episode. And everyone else on the planet is doing little shorty episodes on their podcast. And we thought, well, hey, in your tin, why don't we give it a shot? Yeah, let's try something new for once. Yeah. So I hope you all like it.",1018.9364560769708,4.918233624063247
1041,2,Grandfather Clocks,68,neutral,1125,1132,7,"Great. Well, we've just wasted a lot of time, Chuck. We might not get to the end of this episode now. I thought we agreed there was no ticking clock. ",633.1742546458476,1.113924033654053
1041,2,Grandfather Clocks,69,neutral,1132,1147,15,"So you've seen a grandfather clock before, right? Yeah, we had, you know, not the, what is the like the smaller version called that hangs on the wall? Actually, I saw those called wag on the wall clocks. Those are the original ones. ",952.7324706986701,4.265343176104342
1041,2,Grandfather Clocks,70,neutral,1147,1167,20,"Okay, we had one of those growing up. Or it's just like an exposed pendulum swinging back and forth. Yeah, you know, three-ish feet. Three-ish feet in length? Yeah. Oh, okay. I thought you meant like off the wall. No, yeah. That sounds dangerous. My dad rigged up a hovering mechanism. It was pretty advanced. Right. And the pendulum was super sharp, so you better watch out. ",642.1179677694582,1.2021251417040226
1041,2,Grandfather Clocks,71,neutral,1167,1186,19,"But you're familiar with the kind that are tall and stand on the floor. Yeah. So those are actually, you know and love them as grandfather clocks. Sure. But the name grandfather clock didn't come around until about 200 years after grandfather clocks were invented.",522.7562810313532,0.025004086555058657
1041,2,Grandfather Clocks,72,neutral,1186,1203,17,"Yeah, and it's funny when I saw this that they were invented about 350 years ago and when I saw that they were originally called long case clocks I immediately would like to that name better. Long case better than grandfather. Okay. Yeah, I think it's cool. I'm ambivalent toward both.",477.5551949335649,-0.4207599740521868
1041,2,Grandfather Clocks,73,neutral,1203,1226,23,I like the I do like cuckoo clocks for sure. But the name grandfather clock will we'll find out where it came from but the grandfather clock itself or the long case clock was actually one of the first clocks. And it kind of makes sense because if you think about it when you start out inventing something new it's huge. It's enormous.,478.48260313599303,-0.4116140600522341
1041,2,Grandfather Clocks,74,neutral,1226,1239,13,"And then as you get better at it over time and find like workarounds and shortcuts and stuff, you can make it smaller and smaller. So it makes sense that some of the first actually precise clocks were giant grandfather clocks. ",439.19753049455204,-0.7990355805000848
1041,2,Grandfather Clocks,75,neutral,1239,1248,9,"And again, they were originally, they just had the pendulum swinging back and forth. You could mount them on the wall. They were called wag on the wall clocks. ",465.0959364096417,-0.5436306869320527
