subject,story,valence,event_start_sec,event_end_sec,event_duration_sec,transcript,mean_pupil_size,z_pupil
1007,Natalie Wood,negative,1212,1227,15,"Q. Nicklaus Ray, a 42-year-old director who exploited the vulnerable teenager, coercing her into sleeping with him to secure the role. It was yet another horrifying chapter in Natalie's life, all wrapped in Hollywood's glitzy facade.",5292.790214087846,-0.582528696027602
1007,Natalie Wood,negative,1227,1233,6,"On the surface, Natalie's life sparkled, glamorous parties, iconic roles, and the adoration. ",5301.940015394376,-0.547892136246895
1007,Natalie Wood,negative,1233,1238,5,"Beneath the glitz and glamour, Natalie's life was a storm of power plays and heartbreak.",5126.166894057818,-1.2132810360768855
1007,Natalie Wood,negative,1238,1249,11,That seemed to change when she met Robert Wagner on the set of A Kiss Before Dying. Sparks flew and their whirlwind romance led to a picture-perfect Hollywood marriage.,5084.82574757885,-1.3697778870412676
1007,Natalie Wood,negative,1249,1269,20,"But while Natalie escaped from her mother's control, she traded one oppressive force for another. Wagner, despite his public adoration of Natalie, had a dark temper. Accusations of infidelity tore their marriage apart, culminating in a dramatic divorce. Natalie remained silent, letting Wagner's narrative stand.",5347.695007719699,-0.3746866781337486
1007,Natalie Wood,negative,1269,1285,16,"But years later, Suzanne Finstad's biography Natasha revealed a bombshell. Natalie had discovered Wagner in an affair with another man. Devastated, she fled home, attempted suicide and survived, but the emotional scars ran deep. ",4978.359908631922,-1.7728041683504079
1007,Natalie Wood,negative,1285,1295,10,"Natalie never shared her side of the story, choosing instead to quietly move on. She married British actor Richard Gregerson, had a daughter, and seemed to find happiness, briefly. ",5318.807962073806,-0.48403854817795167
1007,Natalie Wood,negative,1295,1301,6,"That marriage soon fell apart, leaving her single again, but seemingly stronger.",5387.6769895352545,-0.2233349430619418
1007,Natalie Wood,negative,1301,1312,11,"Then, as if on cue, she found herself in familiar arms, those of Robert Wagner. Within a year, they remarried, publicly declaring their love ""stronger and better than ever."" Their remarriage quickly turned into a rollercoaster, with highs of public success and lows that plunged into murky territory.",4955.301729773881,-1.8600908714923414
1007,Natalie Wood,negative,1312,1331,19,"Their remarriage quickly turned into a rollercoaster, with highs of public success and lows that plunged into murky territory. Natalie focused on TV roles to spend more time at home with her kids, while Robert rediscovered his love for sailing, crediting Natalie for reigniting his passion for the sea.",5175.497443828991,-1.0265403103580761
1007,Natalie Wood,negative,1331,1342,11,"That seemed sweet, right? Until you remember that gypsy prophecy about water, which suddenly makes it feel like a little less romance and more like tempting fate.",5501.505159496502,0.2075614317891019
1007,Natalie Wood,negative,1342,1357,15,"That brings us to November 29th, 1981. Robert, Natalie, and Christopher Walken, a mix of Hollywood elites and awkward third wheel, set sail off the coast of Santa Catalina for what should have been a relaxing weekend.",5018.309806530461,-1.621573886900653
1007,Natalie Wood,negative,1357,1378,21,"Instead, a cocktail of alcohol, old tensions, and bad decisions turned the trip into a stormy mess. The trio's dynamic reportedly flipped between playful banter and fiery arguments, but after a day of heavy drinking, the balance tipped hard toward chaos. At some point during the evening, tempers flared and an explosive fight broke out. ",5341.519406438031,-0.39806440796725134
1007,Natalie Wood,negative,1378,1393,15,"Walken, clearly having no interest in playing referee, sought refuge with the boat's captain, Dennis Davern, leaving Robert and Natalie to duke it out. Other boaters in the area later recounted hearing the unmistakable sounds of a heated argument drifting over the water.",5260.077895945571,-0.7063611296446858
1007,Natalie Wood,negative,1393,1403,10,"Eventually, though, the shouting died down, and the night settled into an eerie, disquieting silence as everyone turned in. Or so they thought.",5275.498510111528,-0.6479864167388234
1007,Natalie Wood,negative,1403,1414,11,"According to the official account, no one noticed Natalie was missing until around midnight. By the time a search began, it was too late. Natalie's lifeless body was discovered floating near the boat.",5344.5708271516405,-0.38651325921306084
1007,Natalie Wood,negative,1414,1425,11,"An autopsy report told a grim but sanitized story. There were bruises on her body because apparently drowning alone wasn't tragic enough, but no signs of a struggle.",5044.990689039315,-1.5205734442614913
1007,Natalie Wood,negative,1425,1462,37,"The verdict, neat and tidy, was accidental drowning, case closed. Or at least that's how those with a vested interest in keeping secrets wanted it. For years, that's where the story sat, tucked neatly under a heavy blanket of silence. Thanks in part to some of the powerful men who had, let's say, left their mark on Natalie's life. Any new attempt to dig into the details was met with resistance and some jaw-dropping apathy. Take the corner, for instance, who reportedly waved off any lingering questions with the ominous phrase, ""Some things are better left unsaid."" And that doesn't exactly scream transparency.",5098.643617040351,-1.317470361925533
1007,Natalie Wood,negative,1462,1474,12,"But over the years, the official story began to crumble thanks largely to the shifting accounts of Robert and Christopher. Initially Wagner claimed that he had no idea how Natalie ended up in the water. ",5134.360595716126,-1.1822637901492925
1007,Natalie Wood,negative,1474,1517,43,"Then as if inspired by late night brainstorming, he suggested she might have tried to take the dinghy ashore and had fallen out. Because of course a woman with a lifelong, very public fear of water would decide at midnight that was the ideal time to go for a solo dinghy adventure. Conveniently, the dinghy itself was missing when the Coast Guard arrived, raising more questions than answers.",5288.499825215615,-0.5987699569771112
1007,Natalie Wood,negative,1517,1535,18,"For many, Wagner's revised account didn't just strain credibility. It wreaked of something darker. Why would Natalie, haunted by her mother's gypsy prophecy, willingly climb into a dinghy alone? Not to mention the bruises and the marks on her thighs and shins, suggesting a struggle, as if she'd been resisting something or someone, pushing or pulling her toward the water. Add to that, the wounds on her neck and head, possibly from being struck hard enough to lose consciousness. And a broken fingernail, a small haunting detail that hinted she may have clawed desperately to save her life. All these clues painted a picture far more chilling than an accidental fall.",5459.55034801516,0.04874155283450108
1007,Natalie Wood,negative,1535,1551,16,"In 2011, cracks began to form in the silence surrounding Natalie's death. Once again, Captain Dennis Davern, who was on the boat that night, claimed that Robert Wagner was responsible. When asked for details, he deflected, leaving investigators to dig further.",5342.588055382366,-0.39401903891441353
1007,Natalie Wood,negative,1551,1562,11,"Natalie's sister, Lana Wood, added fuel. Alleging, Dennis told her Wagner had stopped him from searching for Natalie, allegedly saying quote, ""Leave her there. Teach her a lesson."" ",5143.466254468856,-1.1477943319429642
1007,Natalie Wood,negative,1562,1574,12,"Dennis' confession led to the case being reopened, with Wagner named as a person of interest, but any new findings remain sealed, leaving the truth as murky as the waters Natalie feared, her entire life.",5150.496129851144,-1.1211827487213961
1007,Grandfather Clocks,neutral,1576,1580,4,[music],5524.557137520525,0.29482466168271687
1007,Grandfather Clocks,neutral,1580,1588,8,"Hey, and welcome to Short Stuff, the very brief podcast on Josh. There's Chuck. That's Jerry. Let's get going. No time for laughing, Chuck. ",5232.807439457691,-0.80959340373959
1007,Grandfather Clocks,neutral,1588,1613,25,"Welcome, everybody. And just as a very quick explanation, we had this idea because we often come across cool little interesting tidbits that certainly don't warrant a 45 minute episode. And everyone else on the planet is doing little shorty episodes on their podcast. And we thought, well, hey, in your tin, why don't we give it a shot? Yeah, let's try something new for once. Yeah. So I hope you all like it.",5018.438886199182,-1.6210852559990256
1007,Grandfather Clocks,neutral,1613,1620,7,"Great. Well, we've just wasted a lot of time, Chuck. We might not get to the end of this episode now. I thought we agreed there was no ticking clock. ",5149.299897922708,-1.1257110829783723
1007,Grandfather Clocks,neutral,1620,1635,15,"So you've seen a grandfather clock before, right? Yeah, we had, you know, not the, what is the like the smaller version called that hangs on the wall? Actually, I saw those called wag on the wall clocks. Those are the original ones. ",5094.843573803097,-1.3318554201740114
1007,Grandfather Clocks,neutral,1635,1655,20,"Okay, we had one of those growing up. Or it's just like an exposed pendulum swinging back and forth. Yeah, you know, three-ish feet. Three-ish feet in length? Yeah. Oh, okay. I thought you meant like off the wall. No, yeah. That sounds dangerous. My dad rigged up a hovering mechanism. It was pretty advanced. Right. And the pendulum was super sharp, so you better watch out. ",5463.259545781735,0.06278271568344171
1007,Grandfather Clocks,neutral,1655,1674,19,"But you're familiar with the kind that are tall and stand on the floor. Yeah. So those are actually, you know and love them as grandfather clocks. Sure. But the name grandfather clock didn't come around until about 200 years after grandfather clocks were invented.",6090.614811718866,2.4376351790767696
