subject,story,valence,event_start_sec,event_end_sec,event_duration_sec,transcript,mean_pupil_size,z_pupil
1007,Pool Party,positive,0,12,12,[applause],5998.280746357618,2.0881047064972114
1007,Pool Party,positive,12,35,23,"So, like many other younger children, when I was little, I lived what I call a phase-to-phase lifestyle. And this was pretty much, I was defined by whatever phase I was in. And these phases would be like TV shows or books or something that I just become obsessed with and devote my entire existence to and then have that whole thing completely shift in like a week. ",5948.656634573539,1.9002527021977271
1007,Pool Party,positive,35,43,8,And this would become a big dilemma come birthday time when grandma was getting me hot wheels when I had already fully transitioned into Power Rangers territory.,6073.096826114365,2.371320869585174
1007,Pool Party,positive,43,59,16,"But there was something different to my phases and that was that I had this theme to them like this overarching theme and that was the color red. And it wasn't anything satanic or it was just, I really love the color red and all characters and things associated with it.",5901.5597950264555,1.7219676833426523
1007,Pool Party,positive,59,84,25,"I remember I was five years old and in the back seat of a rental car that my dad was driving and my whole family was in, and my mom and my brother. And I was just sitting there and I was just thinking, why do I have to be in this car when I have the ability of super speed? And this was during my superhero phase, of course, I gravitated towards the red flash. But this time, I actually thought I had his superpowers and I could run and get to our destination.",5585.593026448785,0.5258759320664187
1007,Pool Party,positive,84,106,22,And we were headed to my uncle's pool party in New Jersey. And it was a very exciting time. It was an annual summer pool party. And it was so different for me. It was this new world. It was suburbia. It was staying up late and going to the mall. And there was a pool table and a ping pong table and a pool for the pool party.,5589.957073468032,0.5423960258262774
1007,Pool Party,positive,106,119,13,"And there was also Michael. Now, Michael was always introduced to me as Uncle Dan's partner. So I thought my Uncle Dan was in the FBI or something.",5636.490560981127,0.7185484763611077
1007,Pool Party,positive,119,136,17,"But I was told to call him Uncle Michael, which kind of confused me because he wasn't my uncle. I always defined family, defined my uncles and aunts as people who were related to me by blood or by marriage and Michael was neither. ",5706.326300950679,0.9829115702961599
1007,Pool Party,positive,136,158,22,"But I had no problem calling him Uncle Michael because he was like an uncle to me. He was amazing. He was the adult who would actually pay attention to my brother and I when we were little. All the other adults would just come up to us and be like, wow, you grew up so quickly. But Uncle Michael would actually play with us and talk with us and really make all these family gatherings so special for my brother and I.",5413.558723842659,-0.12535967479824917
1007,Pool Party,positive,158,172,14,"So we're at the pool party and my brother and I, we just want to get into the pool. Like that's our goal. We live in the city. We don't really get to do that that much. So the second we're in there, we jump in the pool and we're having some fun.",5521.60537608225,0.2836507729729964
1007,Pool Party,positive,172,193,21,"I'm staying in the shallow end, but my brother, who just kind of learned to swim, is swimming all around. He's very excited. This is his new skill that I don't possess. And I'm just sitting there, and I'm waiting for Uncle Michael to get in the pool, because once Uncle Michael's in the pool, that means splash fights, that means diving contests, that means a really fun time.",5489.2384474839455,0.16112581098142575
1007,Pool Party,positive,193,206,13,But he's all the way at the other end of the backyard and he's grilling everything and I'm just waiting there watching my brother flex on me and swim all over the place. And I'm getting really envious and then it hits me. ,5489.759557238836,0.16309847121446325
1007,Pool Party,positive,206,223,17,"Today, I have the abilities of the Flash. I have super speed. And if I put my super speed to work, I could probably use it and get to the deep end of that pool. If I'm moving super quickly, if my body's going, I'm going to float. I'm going to make it. I'm going to develop buoyancy.",5688.055240061247,0.9137464953887854
1007,Pool Party,positive,223,240,17,"So I'm getting impatient. I'm not waiting for Uncle Michael and I decide to take off and I think I'm going really quickly like I'm running. I'm using all my force, but I'm a puny little five year old and I'm in water. So I'm moving very slowly and I'm running.",5719.803754738567,1.0339304523655135
1007,Pool Party,positive,240,248,8,"And the way this pool is set up is there's a very shallow end, which I can stand in and then a steep incline and then a very deep end that I cannot swim in.",5791.599717166277,1.305713965616885
1007,Pool Party,positive,248,276,28,"So I take off and I'm running and the second I hit the ramp, I slide in and I lose all my power and I'm trying to break the surface of the water and I'm swimming up. and trying to break it but I can't and I'm getting tired and my eyes are sort of closing and this is a sensation known as drowning. So I'm drowning. and I'm in the pool drowning and I'm trying to call for help but no one can really hear me and my eyes are really coming down now",5559.58800992345,0.4274339791427857
1007,Pool Party,positive,276,292,16,and all of a sudden I feel something grab me all around my stomach and pull me out of the pool and pull me onto the surface of the concrete that was right by the pool and open my eyes for a little second and I see Uncle Michael's face.,5782.93536838394,1.2729150856733265
1007,Pool Party,positive,292,304,12,"And then he pulled me into the house and put me in the master bed, which was like temperpedic with a really nice warm pillow. And I fell right to sleep.",6072.564745508836,2.3693066792127087
1007,Pool Party,positive,304,324,20,"Now, recently my biological uncle and Uncle Michael broke up. And this was really rough for me because it meant I really wouldn't get to see him. These pool parties would no longer have Uncle Michael at them, which was a really rough thing for me you know, he was such an influential part of my life. ",5935.840656510853,1.8517378355415888
1007,Pool Party,positive,324,348,24,But he will forever change my definition of family. My definition of family is no longer related by blood or by marriage. It's someone who would run from the backyard and ruin his really nicely picked out summer outfit just because he saw that red bathing suit going up and down and he thought maybe there's a chance that David's in trouble and he jumped in and he saved my life.,5758.484569706659,1.180356622194209
1007,Pool Party,positive,348,367,19,"And I'll also never forget waking up on that summer day to a red Clifford the dog plate with a hot dog on it with a line of red tomato ketchup and a red post-it on it with writing on it that said, here I come to save the day. Love, Uncle Michael. Thank you.",5590.299680424769,0.5436929639717898
1007,Pool Party,positive,367,374,7,[applause],5565.067833484213,0.44817784340731776
1007,Sea Ice,neutral,376,389,13,"I'm an arctic guy. I study arctic science. When I go to a cocktail party and I tell people what I do, they kind of run away from me usually. The northern hemisphere of your planet Earth, where you live, it's covered with an ocean, but on top of that ocean is a sea ice cover. ",5725.971388460953,1.057278021014733
1007,Sea Ice,neutral,389,408,19,"So when I started my research work in the arctic, and there wasn't much happening, really. It wasn't no big changes going on in the sea ice cover. We never really thought that sea ice would become sort of a fundamental characteristic of our international discourse about global warming and the fact that our planet is warming at a global scale.",5350.37247087568,-0.3645511451799793
1007,Sea Ice,neutral,408,428,20,And we're going to have at some point in the near future no ice in the northern hemisphere in summer. Now that's a very major change that's happened on our planet system. And I work with a whole bunch of scientists from all around the world that study this. And we study the sea ice itself. We also study the connections with glacial ice and the land and all those kind of things.,5551.871234417354,0.39822213648337806
1007,Sea Ice,neutral,428,456,28,"But when you look at what's happening to the sea ice cover, this change that we have, this reduction, we found recently that this is significant over at least the last 1,450 years. So that includes the last medieval warm period it includes the cold periods before that it includes right up to before the industrial revolution so in fact what we're seeing in the Arctic right now is unique to our time scale of what we're talking about on the planet.",5551.586331524097,0.39714363698777194
1007,Sea Ice,neutral,456,470,14,To do this work we have a whole bunch of tools. One of our largest and most visible tools is the research icebreaker the Amundsen. The Amundsen is a ship that will hold 40 scientists and we can deploy to the Arctic anywhere in the Arctic for any amount of time.,5693.297713208629,0.93359187000238
1007,Sea Ice,neutral,470,483,13,"So we've overwintered now twice in the high Arctic and we're studying everything in this system. So we study everything from the bottom of the ocean to the top of the atmosphere in the physical world, everything from viruses to whales in the biological world and all the connections between those.",5747.916245936555,1.1403502476531762
1007,Sea Ice,neutral,483,498,15,"This takes a lot of people so the networks are not just here at the University of Manitoba but We have a national network called ArcticNet, which includes Laval University and many other universities across the country. We also have an international network, which includes universities around the world that study the Arctic.",5767.451540858272,1.2143010786845416
1007,Sea Ice,neutral,498,508,10,Now I could talk for a long time about this. I write books about these kind of things. But I wanted to just highlight a few key things that are happening. And these are things that we were surprised about.,5693.44630912396,0.9341543796276847
1007,Sea Ice,neutral,508,525,17,"First one is, multi-year sea ice is being replaced with very thin first-year sea ice. So multi-year sea ice is really, really thick, really, really hard. And this young stuff is very saline. It's very salty. Remember, it's an ocean that this ice forms on. Even if you were to taste it, you'd spit it out right away because it's really, really salty.",5584.108396506228,0.520255867538798
1007,Sea Ice,neutral,525,551,26,"The other thing is we're finding crystals in the ice itself called ikaite, which is associated with how CO2 moves through the systems. Up until just recently, we thought the ocean was capped by this ice cover and that CO2 couldn't move between the ocean and the atmosphere. CO2 is the big problem, right? This is what's causing our planet to warm, and we thought that it was decoupled in the Arctic, but we're finding, in fact, it's not. This young sea ice actually plays an active role in exchanging carbon dioxide with the surface.",5571.6532087603355,0.47310677211170465
1007,Sea Ice,neutral,551,562,11,"There are similar processes going on with bromine, mercury, and they're very reactive with the atmosphere, so we're very concerned about what these young ice types mean for the evolution of the Arctic atmosphere.",5713.795489984021,1.0111861747164872
1007,Sea Ice,neutral,562,586,24,"Snow on sea ice is also very important. Snow falls on the sea ice. When it falls on ice, it's already there. It forms a thick blanket. It insulates that ice, so the ice can't grow as thick as it would have otherwise. If it falls in the open ocean, it does absolutely nothing at all. So what that's doing is it's protecting this multi-year sea ice from growing too thick, which means that it gets thinner and thinner each year because the snow cover doesn't allow it to grow as thick as it used to be.",5864.295919112894,1.5809053342816124
1007,Sea Ice,neutral,586,608,22,"Of course, this is affecting the animals that live in this environment, in particular polar bears. You've probably heard in the media that polar bears, the sea ice is disappearing. This is an important habitat for the polar bear. So what's going to happen with our polar bears? We have lots of them here in Manitoba. We have lots of them in Canada. Unfortunately, it's not as simple and straightforward as reduction in sea ice means reduction in polar bear habitat. It's much more complicated than that.",5567.028898274568,0.455601451370966
1007,Sea Ice,neutral,608,622,14,"The big problem is when you remove all the sea ice and you have open water. In those areas, the length of that open water is really important because the polar bears have to go on land and have to be able to forage on the sea ice. They have to wait for it to happen in the fall.",5214.019289570071,-0.8807159183112421
1007,Sea Ice,neutral,622,639,17,"When you look at the rest of the ecosystem in the Arctic, a good way to think about it is that the sea ice acts like the trees in a tropical rainforest. If you're sitting in your seat right now and you think, okay, if we clear cut all the tropical rainforest trees, we can expect there to be an impact on everything in the tropical ecosystem, right? ",5496.996665164537,0.19049453293320964
1007,Sea Ice,neutral,639,651,12,"Well, sea ice plays exactly the same role. If you get rid of all the sea ice, it changes the light environment and the heat environment, which affects everything that lives in the ocean because the ocean has evolved to take advantage of the timing and presence of the sea ice.",5559.922567044244,0.42870044464583046
1007,Sea Ice,neutral,651,663,12,"So in fact, our research work shows that the change in sea ice is affecting everything in the marine system, right? From the very smallest viruses and bacteria all the way up through the food chain to polar bears, ring seals, those kinds of things. ",5479.206315137592,0.12314918830936517
1007,Sea Ice,neutral,663,676,13,"Another thing we're finding about the ecosystem is that invasive species are becoming a key thing in the Arctic. So on the Atlantic side of the Arctic, we're getting species moving north and displacing the Arctic species. The same's happening on the Pacific side.",5571.999242291686,0.4744166815505237
1007,Sea Ice,neutral,676,695,19,"The other thing that was surprising to us is just how thick some of the multi-year ice is. It piles up on itself. When it piles up on itself, it can actually get thicker in very localized areas in the Arctic. And so this was a big surprise to us as well. This idea of the ice being able to move faster is also a big hazard.",5450.75173397377,0.015434411944514092
1007,Sea Ice,neutral,695,714,19,"What is the big paradox for us from an ice hazards perspective is one of the things that people are looking at the Arctic for is to increase development. CO2 is the thing that is causing a lot of this issue of our warming planet, yet it is opening up the Arctic for new development. And so people around the planet are interested in developing these resources that are there.",5416.811483077661,-0.11304635935881971
1007,Sea Ice,neutral,714,729,15,And of course the big resources are oil and natural gas. There's also lots of minerals and transportation is a big thing but we have to remember that there are hazards that are still there and we need to pay attention to those when we think about how to develop these resources sustainably.,5341.393847945578,-0.39853970946114464
1007,Sea Ice,neutral,729,742,13,"It's very important that you remember that you live on planet Earth, and it is a unit. It functions as a unit. It doesn't operate as Manitoba, Saskatchewan, Ontario, British Columbia, northern states, right? It operates as a whole unit. ",5384.716086734694,-0.2345434363855388
1007,Sea Ice,neutral,742,757,15,"And unfortunately, it doesn't come with a manual. So we have to figure it out. And that's what research groups like mine do, is we try to figure out what these characteristics are so that we can inform you and we can spread these ideas on really cool things like TED.",5543.516025944579,0.3665935067402406
1007,Natalie Wood,negative,759,771,12,[music],5729.374116286092,1.070159042337984
1007,Natalie Wood,negative,771,795,24,"One hand, one heart, even death won't part us now. Those dreamy lyrics from West Side Story sound like a promise, don't they? A vowing of undying love between two star crossed lovers, played to perfection, a Richard Bamer, and Natalie Wood. Together they became the faces of one of Hollywood's most iconic musicals, leaving audiences in awe for generations.",5561.891460992332,0.4361536898749006
1007,Natalie Wood,negative,795,810,15,"But here's the kicker. If anyone needed a little undying love, or heck maybe even just a hug, it was Natalie Wood. Beneath the glitz and the glamour, her life was more tragic backstory than fairy tale ending.",5577.611226042058,0.4956608380241061
1007,Natalie Wood,negative,810,829,19,"Born in 1938 in San Francisco, Natalie Wood entered the world with stars practically stitched into her baby blanket, and a family ready to cash in on them. Her parents, Nikolai and Maria Zakarinko, were Russian immigrants chasing the ever-illusive American dream.",5538.746117924566,0.34853702674151493
1007,Natalie Wood,negative,829,837,8,Unfortunately their dream came with a catch. They were pretty sure their ticket to success was wrapped up in their talented little daughter.,5589.119713608208,0.5392262012725959
1007,Natalie Wood,negative,837,853,16,"By the time Natalie was four, she was trotted off to work in front of the camera, perfecting her doe-eyed innocence while her dad perfected his drinking habit. Meanwhile, her mom Maria was less supportive cheerleader and more strict Soviet drill sergeant.",5408.383313428795,-0.14495118352986966
1007,Natalie Wood,negative,853,864,11,"Keeping Natalie and her sisters on a schedule so tight, it could have been designed by a bond villain. Maria even added a little flair by scaring the daylights out of them at every single opportunity.",5585.509850417439,0.5255610693185276
1007,Natalie Wood,negative,864,870,6,"Fun childhood, right? Here's where strict parenting veered into the straight up bizarre.",5686.774989472929,0.9089001086147991
1007,Natalie Wood,negative,870,901,31,"After a gypsy fortune teller warned Maria that one of her daughters would die in dark open water, she turned the family home into a live action final destination. The unlucky doomed daughter, Natalie, their golden goose and Maria's retirement plan. Growing up under this prophecy was anything but idealic. Natalie avoided water like she was cursed. Even steering clear of the backyard pool she'd one day own in her Hollywood hay day, a glamorous starlit with a fear of her own luxury.",5628.685375500965,0.6890019578711187
1007,Natalie Wood,negative,901,908,7,"Dramatic? Sure, but when your mom acts like Poseidon's got your number, the deep end is off limits.",5357.7944044631095,-0.3364554261826751
1007,Natalie Wood,negative,908,925,17,"Still, Natalie's on-screen presence was pure sunshine. Soft, warm and captivating, she dazzled audiences and became a household name by her teens. Girls across America didn't just admire her, they wanted to be her, perfect hair and all.",5526.799162870473,0.3033118454435161
1007,Natalie Wood,negative,925,930,5,"Time wasn't on Natalie's side, and the injenue act couldn't last forever. ",5655.694022442245,0.7912431523012092
1007,Natalie Wood,negative,930,947,17,"Enter, rebel without a cause. As Judy, a rebellious teen stirring the pots, Natalie shed her innocent image and stepped into the role light years from her real life personality. Sharing the screen with James Dean, she proved she was more than a sweet face.",5251.982781013395,-0.7370051756612814
1007,Natalie Wood,negative,947,957,10,"This was her transformation. Hollywood had boxed her in for years, but with one defiant role, Natalie broke free. Audiences could not get enough.",5519.882050605918,0.27712712684311075
1007,Natalie Wood,negative,957,972,15,"As she grew into a Hollywood icon, her talent only deepened. Eleven Academy Award nominations later, with ten wins under her belt, Natalie Wood wasn't just a star, she was THE star. Her life sparkled like a fairy tale.",5426.018699328812,-0.07819245538723688
1007,Natalie Wood,negative,972,981,9,"But fairy tales gloss over the ugly truths. Beneath Hollywood's glittering veneer lay a far darker story, one the cameras didn't capture.",5405.437983683959,-0.15610072507325892
1007,Natalie Wood,negative,981,996,15,"By this time, Natalie's father, Nikolai, had fully embraced his role as the family drunk, a position he held with alarming dedication. His drinking soon turned violent, adding another layer of chaos to an already oppressive household.",5559.603104666149,0.42749112026971925
1007,Natalie Wood,negative,996,1009,13,"Meanwhile, Maria was still in charge, running the show with an iron fist and a steady stream of terrifying prophecy reminders, because nothing says family bonding, like ominous predictions about your watery demise.",5276.695272727273,-0.6434560735658
1007,Natalie Wood,negative,1009,1034,25,"For Natalie, there was no escape. At home, her parents manipulated her every move, ensuring the money kept pouring in. On set, directors used their own brand of coercion to squeeze out the perfect performance. Wherever she went, Natalie was boxed in by people who saw her as a means to an end rather than a person. It wasn't just control, it was soul crushing, and Natalie had nowhere to turn.",5235.8673226569,-0.7980102202582448
1007,Natalie Wood,negative,1034,1051,17,"From an early age, Natalie learned to see danger everywhere. Not the playful, under the bed kind, but real, tangible threats no one protected her from. Instead of shielding her, those around Natalie often nudged, sometimes shoved, her straight into harm's way.",5258.428171858436,-0.7126061578208648
1007,Natalie Wood,negative,1051,1064,13,"At home, some dangers were oddly comforting, like her doll collection, which came alive to keep her company. It's cute until you realize that's just lonely child code for ""I had no one else.""",5115.82516209653,-1.2524296476491998
1007,Natalie Wood,negative,1064,1071,7,"But the more sinister dangers, those were very real, lurking beyond her understanding, waiting to strike.",4972.121794025458,-1.7964185422856616
1007,Natalie Wood,negative,1071,1084,13,"By 15, Natalie's life became a full-blown Hollywood soap opera. When she came home with big news, her high school sweetheart had proposed, she'd said, ""Yes,"" she probably expected congratulations.",5328.674554315511,-0.44668857733565936
1007,Natalie Wood,negative,1084,1090,6,"Instead, she got Maria's wrath, a level of fury that could have made the devil himself take notes. ",5298.455016666667,-0.5610845939543474
1007,Natalie Wood,negative,1090,1103,13,"Maria wasn't just angry, she was calculating. To her, Natalie's high school Romeo wasn't just a distraction, he was a threat to her iron grip on Natalie's career and the family's golden ticket.",5081.484614694637,-1.3824257408035932
1007,Natalie Wood,negative,1103,1117,14,"Worse, Maria had already someone else in mind for her daughter. Frank Sinatra. Old blue eyes himself, a man not only old enough to be Natalie's father, but with cufflinks likely older than her teenage fiance.",5377.196845539912,-0.26300751319152815
1007,Natalie Wood,negative,1117,1132,15,"For Maria, love was irrelevant when her career connections were on the line. According to a book by Frank Sinatra's former right-hand man, George Jacobs, Maria wasn't just overbearing, she was downright exploitive.",5143.13241308314,-1.1490580880318955
1007,Natalie Wood,negative,1132,1151,19,"She orchestrated what can only be described as a sleazy Hollywood audition, dragging Natalie to Sinatra's home under the guise of a casual meeting. The unspoken plan to deliver her underage daughter on a silver platter, ensuring Sinatra got what he wanted without the messy business of legal trouble.",5186.470887953012,-0.9850003532957706
1007,Natalie Wood,negative,1151,1176,25,"Maria, ever the master manipulator, had already set the stage. She forced Natalie to end her engagement with her high school sweetheart, dressed her in a tight black party dress, and practically delivered her into Sinatra's lap. And Sinatra, a man not exactly famous for his restraint didn't hesitate to play along. Just like that, Natalie found herself ensnared and yet another web of exploitation.",5083.997294968957,-1.3729139932130527
1007,Natalie Wood,negative,1176,1190,14,"Meanwhile, her ex-Fiancé, heartbroken and blind sighted, was left in emotional ruins. The devastation was so profound that he attempted to take his own life. Yet another tragic consequence of Maria's ruthless schemes.",5154.751343631375,-1.1050746430324287
1007,Natalie Wood,negative,1190,1202,12,"From then on, Natalie's life included a shadowy entourage, Sinatra's men, who followed her under the guise of protection. ",4964.32379233245,-1.8259378665596415
1007,Natalie Wood,negative,1202,1212,10,"But their watchful eyes didn't shield her from Hollywood's darker side. When she landed the role in Rebel Without A Cause, Natalie wasn't just expected to act like a rebellious teen. She was pressured to prove she could be a bad girl.",5146.660381430497,-1.1357029688906228
