subject,group,story,event_num,valence,event_start_sec,event_end_sec,event_duration_sec,transcript,mean_pupil_size,z_pupil
1021,3,Grandfather Clocks,80,neutral,1213,1245,32,"Right. And this is actually where the name grandfather clock comes from. It's from this guy's song. And it's a pretty sweet song, actually. It's very sad. He basically sings about how his grandfather, his great-grandparents bought a long-case clock on the day his grandfather was born. Yeah. What a great baby gift. Right, exactly. Here you go, kid. Maybe someday you'll be this tall. Who knows? Here's a grandfather, a long-case clock and a wooby. Right, exactly. Don't let it fall on you.",1606.0264293342302,0.10908630562982827
1021,3,Grandfather Clocks,81,neutral,1245,1265,20,"But they, so they bought, yeah, I guess now that you pointed out it’s a weird baby gift, but it was a great sturdy, reliable clock and it worked through the grandfather's whole life until, until the day he died and the day that the grandfather died, the clock stopped as well and it still hasn't worked since.",1443.554085184535,-0.14919995779675052
1021,3,Grandfather Clocks,82,neutral,1265,1280,15,"Yeah, here's the lyric. My grandfather's clock was too large for the shelf, so it stood 90 years on the floor. It was bought on the morn’ of the day he was born, and was always his treasure and pride, but it stopped short, never to go again when the old man died. ",1014.9082133070384,-0.8306287951775917
1021,3,Grandfather Clocks,83,neutral,1280,1295,15,"Yeah, and America was like, oh, God, this is the greatest song anyone will ever write. We can just stop. We can stop improving on grandfather clocks. We can stop writing songs now. And the two come together in this writing by Work, or this song by Henry Clay Work, right?",1491.6962396024248,-0.07266719621829061
1021,3,Grandfather Clocks,84,neutral,1295,1314,19,"Yeah, it was a big, big hit. He sold close to a million copies, made the equivalent of about $95,000 on the song. Johnny Cash would record it. Prairie Home Companion spoofed it. I think Skrillex. Just kidding. Remixed it. It was in a video game called Five Nights at Freddy's. ",1651.4331166921984,0.18127042824864678
1021,3,Grandfather Clocks,85,neutral,1314,1330,16,"Yeah, and if you look it up in the OED, the Oxford English Dictionary, if you look up grandfather clock, it attributes the etymology of that term to Work. Yeah. Henry Clay Work. ",2018.4533812569866,0.764731528858682
1021,3,Grandfather Clocks,86,neutral,1330,1352,22,"But his name does not stick to the brain. No. Even having Henry Clay in it. I know. You think that would do it for us. Yeah, but Henry Clay Work, it just does not stick. So it was a huge deal and there's, it's pretty much undisputed. I think it's 100% undisputed that Henry Clay Work was the person who came up with this song that later became the name for long case clocks, grandfather clocks. Right.",1735.9114595630722,0.31556771825686936
1021,3,Pool Party,87,positive,1354,1366,12,[applause],1355.646759793961,-0.28894838527088185
1021,3,Pool Party,88,positive,1366,1389,23,"So, like many other younger children, when I was little, I lived what I call a phase-to-phase lifestyle. And this was pretty much, I was defined by whatever phase I was in. And these phases would be like TV shows or books or something that I just become obsessed with and devote my entire existence to and then have that whole thing completely shift in like a week. ",1809.6729903461508,0.4328282297014055
1021,3,Pool Party,89,positive,1389,1397,8,And this would become a big dilemma come birthday time when grandma was getting me hot wheels when I had already fully transitioned into Power Rangers territory.,724.5618713938896,-1.2921994836833732
1021,3,Pool Party,90,positive,1397,1413,16,"But there was something different to my phases and that was that I had this theme to them like this overarching theme and that was the color red. And it wasn't anything satanic or it was just, I really love the color red and all characters and things associated with it.",1716.5552633175525,0.2847966991731503
1021,3,Pool Party,91,positive,1413,1438,25,"I remember I was five years old and in the back seat of a rental car that my dad was driving and my whole family was in, and my mom and my brother. And I was just sitting there and I was just thinking, why do I have to be in this car when I have the ability of super speed? And this was during my superhero phase, of course, I gravitated towards the red flash. But this time, I actually thought I had his superpowers and I could run and get to our destination.",1364.3907073971416,-0.27504791768150283
1021,3,Pool Party,92,positive,1438,1460,22,And we were headed to my uncle's pool party in New Jersey. And it was a very exciting time. It was an annual summer pool party. And it was so different for me. It was this new world. It was suburbia. It was staying up late and going to the mall. And there was a pool table and a ping pong table and a pool for the pool party.,1702.813017363212,0.2629503143178588
1021,3,Pool Party,93,positive,1460,1473,13,"And there was also Michael. Now, Michael was always introduced to me as Uncle Dan's partner. So I thought my Uncle Dan was in the FBI or something.",1935.1198431299445,0.6322541629808386
1021,3,Pool Party,94,positive,1473,1490,17,"But I was told to call him Uncle Michael, which kind of confused me because he wasn't my uncle. I always defined family, defined my uncles and aunts as people who were related to me by blood or by marriage and Michael was neither. ",1697.1396269006577,0.25393118659367797
1021,3,Pool Party,95,positive,1490,1512,22,"But I had no problem calling him Uncle Michael because he was like an uncle to me. He was amazing. He was the adult who would actually pay attention to my brother and I when we were little. All the other adults would just come up to us and be like, wow, you grew up so quickly. But Uncle Michael would actually play with us and talk with us and really make all these family gatherings so special for my brother and I.",1399.9132967847952,-0.2185767876058498
1021,3,Pool Party,96,positive,1512,1526,14,"So we're at the pool party and my brother and I, we just want to get into the pool. Like that's our goal. We live in the city. We don't really get to do that that much. So the second we're in there, we jump in the pool and we're having some fun.",1341.9940120251715,-0.31065249266935224
1021,3,Pool Party,97,positive,1526,1547,21,"I'm staying in the shallow end, but my brother, who just kind of learned to swim, is swimming all around. He's very excited. This is his new skill that I don't possess. And I'm just sitting there, and I'm waiting for Uncle Michael to get in the pool, because once Uncle Michael's in the pool, that means splash fights, that means diving contests, that means a really fun time.",786.5931674219854,-1.193586813628936
1021,3,Pool Party,98,positive,1547,1560,13,But he's all the way at the other end of the backyard and he's grilling everything and I'm just waiting there watching my brother flex on me and swim all over the place. And I'm getting really envious and then it hits me. ,1723.6000469120079,0.29599596413595686
1021,3,Pool Party,99,positive,1560,1577,17,"Today, I have the abilities of the Flash. I have super speed. And if I put my super speed to work, I could probably use it and get to the deep end of that pool. If I'm moving super quickly, if my body's going, I'm going to float. I'm going to make it. I'm going to develop buoyancy.",2483.1343454155162,1.5034462347127726
1021,3,Pool Party,100,positive,1577,1594,17,"So I'm getting impatient. I'm not waiting for Uncle Michael and I decide to take off and I think I'm going really quickly like I'm running. I'm using all my force, but I'm a puny little five year old and I'm in water. So I'm moving very slowly and I'm running.",2197.6121880279024,1.0495446704613487
1021,3,Pool Party,101,positive,1594,1602,8,"And the way this pool is set up is there's a very shallow end, which I can stand in and then a steep incline and then a very deep end that I cannot swim in.",2289.9529789047842,1.1963410865669117
1021,3,Pool Party,102,positive,1602,1630,28,"So I take off and I'm running and the second I hit the ramp, I slide in and I lose all my power and I'm trying to break the surface of the water and I'm swimming up. and trying to break it but I can't and I'm getting tired and my eyes are sort of closing and this is a sensation known as drowning. So I'm drowning. and I'm in the pool drowning and I'm trying to call for help but no one can really hear me and my eyes are really coming down now",2327.536021960765,1.2560877702867315
1021,3,Pool Party,103,positive,1630,1646,16,and all of a sudden I feel something grab me all around my stomach and pull me out of the pool and pull me onto the surface of the concrete that was right by the pool and open my eyes for a little second and I see Uncle Michael's face.,1974.084301647789,0.6941969166826101
1021,3,Pool Party,104,positive,1646,1658,12,"And then he pulled me into the house and put me in the master bed, which was like temperpedic with a really nice warm pillow. And I fell right to sleep.",1674.4092271325653,0.21779611355697878
1021,3,Pool Party,105,positive,1658,1678,20,"Now, recently my biological uncle and Uncle Michael broke up. And this was really rough for me because it meant I really wouldn't get to see him. These pool parties would no longer have Uncle Michael at them, which was a really rough thing for me you know, he was such an influential part of my life. ",1531.9960511192303,-0.008601599159625786
1021,3,Pool Party,106,positive,1678,1702,24,But he will forever change my definition of family. My definition of family is no longer related by blood or by marriage. It's someone who would run from the backyard and ruin his really nicely picked out summer outfit just because he saw that red bathing suit going up and down and he thought maybe there's a chance that David's in trouble and he jumped in and he saved my life.,1468.5690102000913,-0.10943311904041944
1021,3,Pool Party,107,positive,1702,1721,19,"And I'll also never forget waking up on that summer day to a red Clifford the dog plate with a hot dog on it with a line of red tomato ketchup and a red post-it on it with writing on it that said, here I come to save the day. Love, Uncle Michael. Thank you.",1536.742898298066,-0.0010554199788242143
1021,3,Pool Party,108,positive,1721,1728,7,[applause],1422.9898220343568,-0.18189147041681014
