subject,group,story,event_num,valence,event_start_sec,event_end_sec,event_duration_sec,transcript,mean_pupil_size,z_pupil
1038,2,Sea Ice,78,neutral,1229,1243,14,To do this work we have a whole bunch of tools. One of our largest and most visible tools is the research icebreaker the Amundsen. The Amundsen is a ship that will hold 40 scientists and we can deploy to the Arctic anywhere in the Arctic for any amount of time.,1203.391707004865,1.0461688720723012
1038,2,Sea Ice,79,neutral,1243,1256,13,"So we've overwintered now twice in the high Arctic and we're studying everything in this system. So we study everything from the bottom of the ocean to the top of the atmosphere in the physical world, everything from viruses to whales in the biological world and all the connections between those.",1219.2527577681483,1.1571660914938322
1038,2,Sea Ice,80,neutral,1256,1271,15,"This takes a lot of people so the networks are not just here at the University of Manitoba but We have a national network called ArcticNet, which includes Laval University and many other universities across the country. We also have an international network, which includes universities around the world that study the Arctic.",1049.4891718669144,-0.030856459804320262
1038,2,Sea Ice,81,neutral,1271,1281,10,Now I could talk for a long time about this. I write books about these kind of things. But I wanted to just highlight a few key things that are happening. And these are things that we were surprised about.,1211.7349535156504,1.104555745518879
1038,2,Sea Ice,82,neutral,1281,1298,17,"First one is, multi-year sea ice is being replaced with very thin first-year sea ice. So multi-year sea ice is really, really thick, really, really hard. And this young stuff is very saline. It's very salty. Remember, it's an ocean that this ice forms on. Even if you were to taste it, you'd spit it out right away because it's really, really salty.",1192.3716408563428,0.9690493471062185
1038,2,Sea Ice,83,neutral,1298,1324,26,"The other thing is we're finding crystals in the ice itself called ikaite, which is associated with how CO2 moves through the systems. Up until just recently, we thought the ocean was capped by this ice cover and that CO2 couldn't move between the ocean and the atmosphere. CO2 is the big problem, right? This is what's causing our planet to warm, and we thought that it was decoupled in the Arctic, but we're finding, in fact, it's not. This young sea ice actually plays an active role in exchanging carbon dioxide with the surface.",1024.2297513134638,-0.207624410898862
1038,2,Sea Ice,84,neutral,1324,1335,11,"There are similar processes going on with bromine, mercury, and they're very reactive with the atmosphere, so we're very concerned about what these young ice types mean for the evolution of the Arctic atmosphere.",1197.8287314738186,1.00723861298218
1038,2,Sea Ice,85,neutral,1335,1359,24,"Snow on sea ice is also very important. Snow falls on the sea ice. When it falls on ice, it's already there. It forms a thick blanket. It insulates that ice, so the ice can't grow as thick as it would have otherwise. If it falls in the open ocean, it does absolutely nothing at all. So what that's doing is it's protecting this multi-year sea ice from growing too thick, which means that it gets thinner and thinner each year because the snow cover doesn't allow it to grow as thick as it used to be.",1424.7457386547458,2.5952265220080037
1038,2,Sea Ice,86,neutral,1359,1381,22,"Of course, this is affecting the animals that live in this environment, in particular polar bears. You've probably heard in the media that polar bears, the sea ice is disappearing. This is an important habitat for the polar bear. So what's going to happen with our polar bears? We have lots of them here in Manitoba. We have lots of them in Canada. Unfortunately, it's not as simple and straightforward as reduction in sea ice means reduction in polar bear habitat. It's much more complicated than that.",1143.0065031546121,0.6235871767223141
1038,2,Sea Ice,87,neutral,1381,1395,14,"The big problem is when you remove all the sea ice and you have open water. In those areas, the length of that open water is really important because the polar bears have to go on land and have to be able to forage on the sea ice. They have to wait for it to happen in the fall.",973.0880365797638,-0.565519245018592
1038,2,Sea Ice,88,neutral,1395,1412,17,"When you look at the rest of the ecosystem in the Arctic, a good way to think about it is that the sea ice acts like the trees in a tropical rainforest. If you're sitting in your seat right now and you think, okay, if we clear cut all the tropical rainforest trees, we can expect there to be an impact on everything in the tropical ecosystem, right? ",1014.5474941904571,-0.27538181451715776
1038,2,Sea Ice,89,neutral,1412,1424,12,"Well, sea ice plays exactly the same role. If you get rid of all the sea ice, it changes the light environment and the heat environment, which affects everything that lives in the ocean because the ocean has evolved to take advantage of the timing and presence of the sea ice.",983.8644054928143,-0.4901051376772169
1038,2,Sea Ice,90,neutral,1424,1436,12,"So in fact, our research work shows that the change in sea ice is affecting everything in the marine system, right? From the very smallest viruses and bacteria all the way up through the food chain to polar bears, ring seals, those kinds of things. ",1190.2259828018614,0.9540338174650067
1038,2,Sea Ice,91,neutral,1436,1449,13,"Another thing we're finding about the ecosystem is that invasive species are becoming a key thing in the Arctic. So on the Atlantic side of the Arctic, we're getting species moving north and displacing the Arctic species. The same's happening on the Pacific side.",1060.918437852855,0.04912668654593447
1038,2,Sea Ice,92,neutral,1449,1468,19,"The other thing that was surprising to us is just how thick some of the multi-year ice is. It piles up on itself. When it piles up on itself, it can actually get thicker in very localized areas in the Arctic. And so this was a big surprise to us as well. This idea of the ice being able to move faster is also a big hazard.",1059.471549852714,0.039001219625305124
1038,2,Sea Ice,93,neutral,1468,1487,19,"What is the big paradox for us from an ice hazards perspective is one of the things that people are looking at the Arctic for is to increase development. CO2 is the thing that is causing a lot of this issue of our warming planet, yet it is opening up the Arctic for new development. And so people around the planet are interested in developing these resources that are there.",1439.8342909017222,2.700817719558916
1038,2,Sea Ice,94,neutral,1487,1502,15,And of course the big resources are oil and natural gas. There's also lots of minerals and transportation is a big thing but we have to remember that there are hazards that are still there and we need to pay attention to those when we think about how to develop these resources sustainably.,1534.5451881597478,3.3636140501081453
1038,2,Sea Ice,95,neutral,1502,1515,13,"It's very important that you remember that you live on planet Earth, and it is a unit. It functions as a unit. It doesn't operate as Manitoba, Saskatchewan, Ontario, British Columbia, northern states, right? It operates as a whole unit. ",1419.3120847879202,2.5572012688568786
1038,2,Sea Ice,96,neutral,1515,1530,15,"And unfortunately, it doesn't come with a manual. So we have to figure it out. And that's what research groups like mine do, is we try to figure out what these characteristics are so that we can inform you and we can spread these ideas on really cool things like TED.",1349.8888873774524,2.0713707907304166
