subject,group,story,event_num,valence,event_start_sec,event_end_sec,event_duration_sec,transcript,mean_pupil_size,z_pupil
1042,3,Natalie Wood,1,negative,0,12,12,[music],919.9226477509073,-1.2843660970113802
1042,3,Natalie Wood,2,negative,12,36,24,"One hand, one heart, even death won't part us now. Those dreamy lyrics from West Side Story sound like a promise, don't they? A vowing of undying love between two star crossed lovers, played to perfection, a Richard Bamer, and Natalie Wood. Together they became the faces of one of Hollywood's most iconic musicals, leaving audiences in awe for generations.",1334.2802972973386,0.9480538716793285
1042,3,Natalie Wood,3,negative,36,51,15,"But here's the kicker. If anyone needed a little undying love, or heck maybe even just a hug, it was Natalie Wood. Beneath the glitz and the glamour, her life was more tragic backstory than fairy tale ending.",1219.7796360589953,0.33116273220942744
1042,3,Natalie Wood,4,negative,51,70,19,"Born in 1938 in San Francisco, Natalie Wood entered the world with stars practically stitched into her baby blanket, and a family ready to cash in on them. Her parents, Nikolai and Maria Zakarinko, were Russian immigrants chasing the ever-illusive American dream.",1073.788347729433,-0.4553893386369846
1042,3,Natalie Wood,5,negative,70,78,8,Unfortunately their dream came with a catch. They were pretty sure their ticket to success was wrapped up in their talented little daughter.,1128.546150341795,-0.16037267337867112
1042,3,Natalie Wood,6,negative,78,94,16,"By the time Natalie was four, she was trotted off to work in front of the camera, perfecting her doe-eyed innocence while her dad perfected his drinking habit. Meanwhile, her mom Maria was less supportive cheerleader and more strict Soviet drill sergeant.",1073.141853867547,-0.4588724306192134
1042,3,Natalie Wood,7,negative,94,105,11,"Keeping Natalie and her sisters on a schedule so tight, it could have been designed by a bond villain. Maria even added a little flair by scaring the daylights out of them at every single opportunity.",1409.728864654195,1.354545434127672
1042,3,Natalie Wood,8,negative,105,111,6,"Fun childhood, right? Here's where strict parenting veered into the straight up bizarre.",1381.881058562031,1.204510799863228
1042,3,Natalie Wood,9,negative,111,142,31,"After a gypsy fortune teller warned Maria that one of her daughters would die in dark open water, she turned the family home into a live action final destination. The unlucky doomed daughter, Natalie, their golden goose and Maria's retirement plan. Growing up under this prophecy was anything but idealic. Natalie avoided water like she was cursed. Even steering clear of the backyard pool she'd one day own in her Hollywood hay day, a glamorous starlit with a fear of her own luxury.",1327.6872762440714,0.9125328866814091
1042,3,Natalie Wood,10,negative,142,149,7,"Dramatic? Sure, but when your mom acts like Poseidon's got your number, the deep end is off limits.",1247.3685400564482,0.4798024888680125
1042,3,Natalie Wood,11,negative,149,166,17,"Still, Natalie's on-screen presence was pure sunshine. Soft, warm and captivating, she dazzled audiences and became a household name by her teens. Girls across America didn't just admire her, they wanted to be her, perfect hair and all.",1292.7002498302718,0.7240345290505736
1042,3,Natalie Wood,12,negative,166,171,5,"Time wasn't on Natalie's side, and the injenue act couldn't last forever. ",1193.6643555555559,0.19046236442894948
1042,3,Natalie Wood,13,negative,171,188,17,"Enter, rebel without a cause. As Judy, a rebellious teen stirring the pots, Natalie shed her innocent image and stepped into the role light years from her real life personality. Sharing the screen with James Dean, she proved she was more than a sweet face.",959.3392157550568,-1.0720028557244392
1042,3,Natalie Wood,14,negative,188,198,10,"This was her transformation. Hollywood had boxed her in for years, but with one defiant role, Natalie broke free. Audiences could not get enough.",1108.15476445779,-0.27023461773172164
1042,3,Natalie Wood,15,negative,198,213,15,"As she grew into a Hollywood icon, her talent only deepened. Eleven Academy Award nominations later, with ten wins under her belt, Natalie Wood wasn't just a star, she was THE star. Her life sparkled like a fairy tale.",1115.6530352635143,-0.2298364508445579
1042,3,Natalie Wood,16,negative,213,222,9,"But fairy tales gloss over the ugly truths. Beneath Hollywood's glittering veneer lay a far darker story, one the cameras didn't capture.",1075.977718285331,-0.443593744774532
1042,3,Natalie Wood,17,negative,222,237,15,"By this time, Natalie's father, Nikolai, had fully embraced his role as the family drunk, a position he held with alarming dedication. His drinking soon turned violent, adding another layer of chaos to an already oppressive household.",1102.8960462019672,-0.2985668270124423
1042,3,Natalie Wood,18,negative,237,250,13,"Meanwhile, Maria was still in charge, running the show with an iron fist and a steady stream of terrifying prophecy reminders, because nothing says family bonding, like ominous predictions about your watery demise.",1209.667172719732,0.27668017320288885
1042,3,Natalie Wood,19,negative,250,275,25,"For Natalie, there was no escape. At home, her parents manipulated her every move, ensuring the money kept pouring in. On set, directors used their own brand of coercion to squeeze out the perfect performance. Wherever she went, Natalie was boxed in by people who saw her as a means to an end rather than a person. It wasn't just control, it was soul crushing, and Natalie had nowhere to turn.",1111.1301653541036,-0.25420415616533865
1042,3,Natalie Wood,20,negative,275,292,17,"From an early age, Natalie learned to see danger everywhere. Not the playful, under the bed kind, but real, tangible threats no one protected her from. Instead of shielding her, those around Natalie often nudged, sometimes shoved, her straight into harm's way.",746.9677714448108,-2.2161889316345786
1042,3,Natalie Wood,21,negative,292,305,13,"At home, some dangers were oddly comforting, like her doll collection, which came alive to keep her company. It's cute until you realize that's just lonely child code for ""I had no one else.""",887.7393341832625,-1.4577589906762867
1042,3,Natalie Wood,22,negative,305,312,7,"But the more sinister dangers, those were very real, lurking beyond her understanding, waiting to strike.",634.6811578623256,-2.8211515253084
1042,3,Natalie Wood,23,negative,312,325,13,"By 15, Natalie's life became a full-blown Hollywood soap opera. When she came home with big news, her high school sweetheart had proposed, she'd said, ""Yes,"" she probably expected congratulations.",391.0553986383782,-4.133725361882473
1042,3,Natalie Wood,24,negative,325,331,6,"Instead, she got Maria's wrath, a level of fury that could have made the devil himself take notes. ",816.9608129251701,-1.839089911883908
1042,3,Natalie Wood,25,negative,331,344,13,"Maria wasn't just angry, she was calculating. To her, Natalie's high school Romeo wasn't just a distraction, he was a threat to her iron grip on Natalie's career and the family's golden ticket.",891.1607965187193,-1.4393252997617885
1042,3,Natalie Wood,26,negative,344,358,14,"Worse, Maria had already someone else in mind for her daughter. Frank Sinatra. Old blue eyes himself, a man not only old enough to be Natalie's father, but with cufflinks likely older than her teenage fiance.",1049.3906912296857,-0.5868357246730884
1042,3,Natalie Wood,27,negative,358,373,15,"For Maria, love was irrelevant when her career connections were on the line. According to a book by Frank Sinatra's former right-hand man, George Jacobs, Maria wasn't just overbearing, she was downright exploitive.",543.5693091445987,-3.312031591561378
1042,3,Natalie Wood,28,negative,373,392,19,"She orchestrated what can only be described as a sleazy Hollywood audition, dragging Natalie to Sinatra's home under the guise of a casual meeting. The unspoken plan to deliver her underage daughter on a silver platter, ensuring Sinatra got what he wanted without the messy business of legal trouble.",1120.006126906677,-0.20638345384939016
1042,3,Natalie Wood,29,negative,392,417,25,"Maria, ever the master manipulator, had already set the stage. She forced Natalie to end her engagement with her high school sweetheart, dressed her in a tight black party dress, and practically delivered her into Sinatra's lap. And Sinatra, a man not exactly famous for his restraint didn't hesitate to play along. Just like that, Natalie found herself ensnared and yet another web of exploitation.",1258.7222006899265,0.5409722023840033
1042,3,Natalie Wood,30,negative,417,431,14,"Meanwhile, her ex-Fiancé, heartbroken and blind sighted, was left in emotional ruins. The devastation was so profound that he attempted to take his own life. Yet another tragic consequence of Maria's ruthless schemes.",1236.1658362170956,0.4194460799018101
1042,3,Natalie Wood,31,negative,431,443,12,"From then on, Natalie's life included a shadowy entourage, Sinatra's men, who followed her under the guise of protection. ",1115.4540506305289,-0.2309085132732969
1042,3,Natalie Wood,32,negative,443,453,10,"But their watchful eyes didn't shield her from Hollywood's darker side. When she landed the role in Rebel Without A Cause, Natalie wasn't just expected to act like a rebellious teen. She was pressured to prove she could be a bad girl.",914.2210274806215,-1.3150845137202565
1042,3,Natalie Wood,33,negative,453,468,15,"Q. Nicklaus Ray, a 42-year-old director who exploited the vulnerable teenager, coercing her into sleeping with him to secure the role. It was yet another horrifying chapter in Natalie's life, all wrapped in Hollywood's glitzy facade.",1144.5907765681523,-0.07392961140767501
1042,3,Natalie Wood,34,negative,468,474,6,"On the surface, Natalie's life sparkled, glamorous parties, iconic roles, and the adoration. ",1159.8714753031647,0.008397665593074996
1042,3,Natalie Wood,35,negative,474,479,5,"Beneath the glitz and glamour, Natalie's life was a storm of power plays and heartbreak.",1414.5692540240518,1.3806238277505123
1042,3,Natalie Wood,36,negative,479,490,11,That seemed to change when she met Robert Wagner on the set of A Kiss Before Dying. Sparks flew and their whirlwind romance led to a picture-perfect Hollywood marriage.,1126.779359449867,-0.16989154981780233
1042,3,Natalie Wood,37,negative,490,510,20,"But while Natalie escaped from her mother's control, she traded one oppressive force for another. Wagner, despite his public adoration of Natalie, had a dark temper. Accusations of infidelity tore their marriage apart, culminating in a dramatic divorce. Natalie remained silent, letting Wagner's narrative stand.",1164.80750196801,0.034991320868058826
1042,3,Natalie Wood,38,negative,510,526,16,"But years later, Suzanne Finstad's biography Natasha revealed a bombshell. Natalie had discovered Wagner in an affair with another man. Devastated, she fled home, attempted suicide and survived, but the emotional scars ran deep. ",1223.739279842204,0.35249596416547646
1042,3,Natalie Wood,39,negative,526,536,10,"Natalie never shared her side of the story, choosing instead to quietly move on. She married British actor Richard Gregerson, had a daughter, and seemed to find happiness, briefly. ",1141.2190172576832,-0.0920955191025118
1042,3,Natalie Wood,40,negative,536,542,6,"That marriage soon fell apart, leaving her single again, but seemingly stronger.",1200.0533281806338,0.22488400496884267
1042,3,Natalie Wood,41,negative,542,553,11,"Then, as if on cue, she found herself in familiar arms, those of Robert Wagner. Within a year, they remarried, publicly declaring their love ""stronger and better than ever."" Their remarriage quickly turned into a rollercoaster, with highs of public success and lows that plunged into murky territory.",1307.3090813290164,0.8027420108425342
1042,3,Natalie Wood,42,negative,553,572,19,"Their remarriage quickly turned into a rollercoaster, with highs of public success and lows that plunged into murky territory. Natalie focused on TV roles to spend more time at home with her kids, while Robert rediscovered his love for sailing, crediting Natalie for reigniting his passion for the sea.",1196.3941639978275,0.20516965626704742
1042,3,Natalie Wood,43,negative,572,583,11,"That seemed sweet, right? Until you remember that gypsy prophecy about water, which suddenly makes it feel like a little less romance and more like tempting fate.",1274.6103304731698,0.6265721140354172
1042,3,Natalie Wood,44,negative,583,598,15,"That brings us to November 29th, 1981. Robert, Natalie, and Christopher Walken, a mix of Hollywood elites and awkward third wheel, set sail off the coast of Santa Catalina for what should have been a relaxing weekend.",1128.8429098877689,-0.1587738325293306
1042,3,Natalie Wood,45,negative,598,619,21,"Instead, a cocktail of alcohol, old tensions, and bad decisions turned the trip into a stormy mess. The trio's dynamic reportedly flipped between playful banter and fiery arguments, but after a day of heavy drinking, the balance tipped hard toward chaos. At some point during the evening, tempers flared and an explosive fight broke out. ",1244.3715061491155,0.46365547589770423
1042,3,Natalie Wood,46,negative,619,634,15,"Walken, clearly having no interest in playing referee, sought refuge with the boat's captain, Dennis Davern, leaving Robert and Natalie to duke it out. Other boaters in the area later recounted hearing the unmistakable sounds of a heated argument drifting over the water.",1246.4988650237024,0.47511697163067246
1042,3,Natalie Wood,47,negative,634,644,10,"Eventually, though, the shouting died down, and the night settled into an eerie, disquieting silence as everyone turned in. Or so they thought.",1209.51760153493,0.2758743338511642
1042,3,Natalie Wood,48,negative,644,655,11,"According to the official account, no one noticed Natalie was missing until around midnight. By the time a search began, it was too late. Natalie's lifeless body was discovered floating near the boat.",1207.386835581189,0.2643944819190357
1042,3,Natalie Wood,49,negative,655,666,11,"An autopsy report told a grim but sanitized story. There were bruises on her body because apparently drowning alone wasn't tragic enough, but no signs of a struggle.",1158.6594574942478,0.0018677203585736328
1042,3,Natalie Wood,50,negative,666,703,37,"The verdict, neat and tidy, was accidental drowning, case closed. Or at least that's how those with a vested interest in keeping secrets wanted it. For years, that's where the story sat, tucked neatly under a heavy blanket of silence. Thanks in part to some of the powerful men who had, let's say, left their mark on Natalie's life. Any new attempt to dig into the details was met with resistance and some jaw-dropping apathy. Take the corner, for instance, who reportedly waved off any lingering questions with the ominous phrase, ""Some things are better left unsaid."" And that doesn't exactly scream transparency.",1083.8621784531204,-0.4011149191991232
1042,3,Natalie Wood,51,negative,703,715,12,"But over the years, the official story began to crumble thanks largely to the shifting accounts of Robert and Christopher. Initially Wagner claimed that he had no idea how Natalie ended up in the water. ",1096.1240958269002,-0.3350518231524451
1042,3,Natalie Wood,52,negative,715,758,43,"Then as if inspired by late night brainstorming, he suggested she might have tried to take the dinghy ashore and had fallen out. Because of course a woman with a lifelong, very public fear of water would decide at midnight that was the ideal time to go for a solo dinghy adventure. Conveniently, the dinghy itself was missing when the Coast Guard arrived, raising more questions than answers.",1100.040286562035,-0.31395270163776773
1042,3,Natalie Wood,53,negative,758,776,18,"For many, Wagner's revised account didn't just strain credibility. It wreaked of something darker. Why would Natalie, haunted by her mother's gypsy prophecy, willingly climb into a dinghy alone? Not to mention the bruises and the marks on her thighs and shins, suggesting a struggle, as if she'd been resisting something or someone, pushing or pulling her toward the water. Add to that, the wounds on her neck and head, possibly from being struck hard enough to lose consciousness. And a broken fingernail, a small haunting detail that hinted she may have clawed desperately to save her life. All these clues painted a picture far more chilling than an accidental fall.",1078.1092514039574,-0.43210975961544135
1042,3,Natalie Wood,54,negative,776,792,16,"In 2011, cracks began to form in the silence surrounding Natalie's death. Once again, Captain Dennis Davern, who was on the boat that night, claimed that Robert Wagner was responsible. When asked for details, he deflected, leaving investigators to dig further.",965.3230886863654,-1.039763756394226
1042,3,Natalie Wood,55,negative,792,803,11,"Natalie's sister, Lana Wood, added fuel. Alleging, Dennis told her Wagner had stopped him from searching for Natalie, allegedly saying quote, ""Leave her there. Teach her a lesson."" ",884.5306420285455,-1.4750463472567976
1042,3,Natalie Wood,56,negative,803,815,12,"Dennis' confession led to the case being reopened, with Wagner named as a person of interest, but any new findings remain sealed, leaving the truth as murky as the waters Natalie feared, her entire life.",1094.8647835355905,-0.3418365751873472
1042,3,Grandfather Clocks,57,neutral,817,821,4,[music],959.66475,-1.0702489864530516
1042,3,Grandfather Clocks,58,neutral,821,829,8,"Hey, and welcome to Short Stuff, the very brief podcast on Josh. There's Chuck. That's Jerry. Let's get going. No time for laughing, Chuck. ",1111.42690615849,-0.25260541628938177
1042,3,Grandfather Clocks,59,neutral,829,854,25,"Welcome, everybody. And just as a very quick explanation, we had this idea because we often come across cool little interesting tidbits that certainly don't warrant a 45 minute episode. And everyone else on the planet is doing little shorty episodes on their podcast. And we thought, well, hey, in your tin, why don't we give it a shot? Yeah, let's try something new for once. Yeah. So I hope you all like it.",1178.8953594822117,0.11089196965588609
1042,3,Grandfather Clocks,60,neutral,854,861,7,"Great. Well, we've just wasted a lot of time, Chuck. We might not get to the end of this episode now. I thought we agreed there was no ticking clock. ",1028.7084832826747,-0.6982645207097045
1042,3,Grandfather Clocks,61,neutral,861,876,15,"So you've seen a grandfather clock before, right? Yeah, we had, you know, not the, what is the like the smaller version called that hangs on the wall? Actually, I saw those called wag on the wall clocks. Those are the original ones. ",1228.2222680947407,0.37664880050221033
1042,3,Grandfather Clocks,62,neutral,876,896,20,"Okay, we had one of those growing up. Or it's just like an exposed pendulum swinging back and forth. Yeah, you know, three-ish feet. Three-ish feet in length? Yeah. Oh, okay. I thought you meant like off the wall. No, yeah. That sounds dangerous. My dad rigged up a hovering mechanism. It was pretty advanced. Right. And the pendulum was super sharp, so you better watch out. ",1274.431775940356,0.6256101221306212
1042,3,Grandfather Clocks,63,neutral,896,915,19,"But you're familiar with the kind that are tall and stand on the floor. Yeah. So those are actually, you know and love them as grandfather clocks. Sure. But the name grandfather clock didn't come around until about 200 years after grandfather clocks were invented.",1193.6132430231928,0.19018698725654173
1042,3,Grandfather Clocks,64,neutral,915,932,17,"Yeah, and it's funny when I saw this that they were invented about 350 years ago and when I saw that they were originally called long case clocks I immediately would like to that name better. Long case better than grandfather. Okay. Yeah, I think it's cool. I'm ambivalent toward both.",1359.926634479293,1.086227730208165
1042,3,Grandfather Clocks,65,neutral,932,955,23,I like the I do like cuckoo clocks for sure. But the name grandfather clock will we'll find out where it came from but the grandfather clock itself or the long case clock was actually one of the first clocks. And it kind of makes sense because if you think about it when you start out inventing something new it's huge. It's enormous.,1247.0906026993164,0.47830505565594233
1042,3,Grandfather Clocks,66,neutral,955,968,13,"And then as you get better at it over time and find like workarounds and shortcuts and stuff, you can make it smaller and smaller. So it makes sense that some of the first actually precise clocks were giant grandfather clocks. ",1335.34210323006,0.9537745257318754
1042,3,Grandfather Clocks,67,neutral,968,977,9,"And again, they were originally, they just had the pendulum swinging back and forth. You could mount them on the wall. They were called wag on the wall clocks. ",1110.80880239925,-0.2559355519254941
1042,3,Grandfather Clocks,68,neutral,977,1005,28,"And the first person who really tried to invent this thing was none other than Galileo Galilei. Yeah, he's the one that discovered, hey, a pendulum swings at a constant rate, regardless of its size. I think we've got something here, boys. And unfortunately, he died before he could actually make a legit clock. Yeah, but he tried for like his whole life. Yeah. That's what killed him. It was the sharp pendulum. He's like, I regret everything.",1309.825097983636,0.8162974642714244
1042,3,Grandfather Clocks,69,neutral,1005,1020,15,"But a Dutch astronomer named Christiaan Huygens built the very first pendulum clock in the, what, 1657. And this is when, like apparently this is the most accurate timepiece ever in the history of the world.",1340.4949711517022,0.9815364489325009
1042,3,Grandfather Clocks,70,neutral,1020,1037,17,"Yeah, before that it was, the clocks were accurate within 15 minutes every 24 hours. It's pretty good. Sure, for the early 17th century. But then Huygens comes along and his was accurate within a minute every 24 hours. That's great.",1259.7283977086645,0.5463932542688343
1042,3,Grandfather Clocks,71,neutral,1037,1055,18,"Finally, what he had produced was something that you could actually use for like scientific purposes, which again, as you said, he was an astronomer and you need precise clocks for astronomy. So he kind of made a scientific instrument for himself more than, you know, let's make something that everybody sets their watch to.",1347.3010838846178,1.0182055003926411
1042,3,Grandfather Clocks,72,neutral,1055,1066,11,"Yeah, so his wasn't a long case clock though, but because people like to invent and build on others' work, of course it’s got bigger and bigger.",1279.9244948413748,0.6552030483634584
1042,3,Grandfather Clocks,73,neutral,1066,1079,13,"And eventually in London, and what, not even too many years later, three or four years later, the very first long case clocks started, like six feet tall, started to be released for purchase.",1096.1649553782506,-0.3348316856011141
1042,3,Grandfather Clocks,74,neutral,1079,1097,18,"Yeah, and there was a dude named Clement. I can't remember his first name, but he basically made the pendulum so precise that all of a sudden there was a clock that was accurate within a second over 24 hours. And so they added minute hands and second hands and really started to show off.",1119.5654102887615,-0.20875788709430662
1042,3,Grandfather Clocks,75,neutral,1097,1124,27,"But at the time, in the late 17th, early 18th centuries, You had to literally be royalty to afford a clock like this. And then over time, again, as they figured out shortcuts and there were improvements in manufacturing, you just had to be somewhat rich to afford them. And they started to spread and they started to kind of encase them in wood. They started really kind of tricking them out and everything. They made the pendulum look really beautiful.",1223.417255081578,0.3507610028179037
1042,3,Grandfather Clocks,76,neutral,1124,1152,28,"And then what you know and love as a grandfather clock really kind of was developed between, I think, Up to about 1850, I think, right? From the late 17th century up to 1850. That sounds about right. And then that was like kind of the golden age of the grandfather clock. And then they just stopped progressing. They said, this is perfect. This is the grandfather clock, although we don't call it that yet. And we're going to just leave it as is and say, we're happy with this model.",1191.8061097112663,0.18045075939626967
1042,3,Grandfather Clocks,77,neutral,1152,1175,23,"Yeah, so put a pin in that and then we switch on over to the story of a man named Henry Clay Work who was born in Connecticut in 1832. He was a musician, a singer-songwriter, very emo from what I understand. A little bit, I got that too. And it was back in the days when you would write like war songs.",1068.779674507799,-0.4823743891817544
1042,3,Grandfather Clocks,78,neutral,1175,1196,21,That doesn't happen much today unless you count like Toby Keith Whatever work he's doing right whatever good work he's doing. But he was a champion of the north and he had a song called Kingdom Coming a pro-union ballad which gave him a music contract with a publishing firm named Root and Katie or Caddy?,1176.8865197506127,0.10006901529356213
1042,3,Grandfather Clocks,79,neutral,1196,1213,17,"And he started pumping out hits over like the next decade or so until hard times fell. He made some bad financial moves. Two of his kids died in the 1870s. And so he kind of fell on hard times. But he would come back with a big, big hit called grandfather's clock.",958.1450160481957,-1.0784368030043305
